"dataset_id","dataset_name","dataset_category","field_id","field_name","description","field_type","region","universe","delay","coverage","user_permission","permission_level","last_seen","notes"
"analyst45","Analyst Trade Ideas","Analyst","absolute_price_change_today","absolute_price_change_today","Change in stock price since previous day close","VECTOR","USA","TOP3000","1","0.1963","","","2026-07-16T15:20:39","possible_direction=analyst"
"analyst45","Analyst Trade Ideas","Analyst","adjusted_return_for_bias","adjusted_return_for_bias","The return on the idea adjusted for contributor or model bias.","VECTOR","USA","TOP3000","1","0.2476","","","2026-07-16T15:20:39","possible_direction=analyst"
"analyst45","Analyst Trade Ideas","Analyst","aggregate_idea_return","aggregate_idea_return","The sum of realized and unrealized returns for the trade idea.","VECTOR","USA","TOP3000","1","0.1947","","","2026-07-16T15:20:39","possible_direction=analyst"
"analyst45","Analyst Trade Ideas","Analyst","aggregate_return_ex_fx","aggregate_return_ex_fx","The total return for the idea excluding foreign exchange effects.","VECTOR","USA","TOP3000","1","0.1947","","","2026-07-16T15:20:39","possible_direction=analyst"
"analyst45","Analyst Trade Ideas","Analyst","aggregate_return_percent","aggregate_return_percent","The total return as a percentage of average investment.","VECTOR","USA","TOP3000","1","0.1991","","","2026-07-16T15:20:39","possible_direction=analyst"
"analyst45","Analyst Trade Ideas","Analyst","aggregate_trade_return","aggregate_trade_return","Sum of realised and unrealised returns","VECTOR","USA","TOP3000","1","0.1958","","","2026-07-16T15:20:39","possible_direction=analyst"
"analyst45","Analyst Trade Ideas","Analyst","allocated_funds_currency","allocated_funds_currency","The currency used for the investment in the trade idea.","VECTOR","USA","TOP3000","1","0.2498","","","2026-07-16T15:20:39","possible_direction=analyst"
"analyst45","Analyst Trade Ideas","Analyst","anl45_ad_rel_ret_per","anl45_ad_rel_ret_per","Average daily index relative return percentage","VECTOR","USA","TOP3000","1","0.5409","","","2026-07-16T15:20:39","possible_direction=analyst"
"analyst45","Analyst Trade Ideas","Analyst","anl45_ad_ret_per","anl45_ad_ret_per","Average daily percent return over the idea’s lifetime","VECTOR","USA","TOP3000","1","0.553","","","2026-07-16T15:20:39","possible_direction=analyst"
"analyst45","Analyst Trade Ideas","Analyst","anl45_ang_inv","anl45_ang_inv","Time-weighted average investment","VECTOR","USA","TOP3000","1","0.664","","","2026-07-16T15:20:39","possible_direction=analyst"
"analyst45","Analyst Trade Ideas","Analyst","anl45_avg_dur","anl45_avg_dur","Average age of the idea limited to the selected period","VECTOR","USA","TOP3000","1","0.6641","","","2026-07-16T15:20:39","possible_direction=analyst"
"analyst45","Analyst Trade Ideas","Analyst","anl45_avg_initial_prc","anl45_avg_initial_prc","Average share price weighted by volume of each share purchase","VECTOR","USA","TOP3000","1","0.5427","","","2026-07-16T15:20:39","possible_direction=analyst"
"analyst45","Analyst Trade Ideas","Analyst","anl45_avg_initial_prc_wfee","anl45_avg_initial_prc_wfee","The avg initial price adjusted to include fee payment when fees are applied","VECTOR","USA","TOP3000","1","0.5427","","","2026-07-16T15:20:39","possible_direction=analyst"
"analyst45","Analyst Trade Ideas","Analyst","anl45_beta","anl45_beta","A measure of the volatility or systematic risk of a security compared to the market, updated monthly based on last 20 months","VECTOR","USA","TOP3000","1","0.612","","","2026-07-16T15:20:39","possible_direction=analyst"
"analyst45","Analyst Trade Ideas","Analyst","anl45_bias_weighted_ret","anl45_bias_weighted_ret","Non-Functional","VECTOR","USA","TOP3000","1","0.6632","","","2026-07-16T15:20:39","possible_direction=analyst"
"analyst45","Analyst Trade Ideas","Analyst","anl45_bm_exchange_rate","anl45_bm_exchange_rate","Exchange Rate by which the Benchmark will be measured","VECTOR","USA","TOP3000","1","0.0042","","","2026-07-16T15:20:39","possible_direction=analyst"
"analyst45","Analyst Trade Ideas","Analyst","anl45_bm_fx_ret","anl45_bm_fx_ret","FX return made by the benchmark due to currency movements","VECTOR","USA","TOP3000","1","0.5986","","","2026-07-16T15:20:39","possible_direction=analyst"
"analyst45","Analyst Trade Ideas","Analyst","anl45_bm_ret","anl45_bm_ret","Return of the benchmark index","VECTOR","USA","TOP3000","1","0.5793","","","2026-07-16T15:20:39","possible_direction=analyst"
"analyst45","Analyst Trade Ideas","Analyst","anl45_bm_ret_wo_fx","anl45_bm_ret_wo_fx","Benchmark’s return excluding foreign exchange effects (raw benchmark return)","VECTOR","USA","TOP3000","1","0.5793","","","2026-07-16T15:20:39","possible_direction=analyst"
"analyst45","Analyst Trade Ideas","Analyst","anl45_closed_prc","anl45_closed_prc","Price at which the idea was closed","VECTOR","USA","TOP3000","1","0.5096","","","2026-07-16T15:20:39","possible_direction=analyst"
"analyst45","Analyst Trade Ideas","Analyst","anl45_current_inv","anl45_current_inv","Current investment amount, including increases and partial closures","VECTOR","USA","TOP3000","1","0.6641","","","2026-07-16T15:20:39","possible_direction=analyst"
"analyst45","Analyst Trade Ideas","Analyst","anl45_days_since_inception","anl45_days_since_inception","Number of trading days since the idea was submitted","VECTOR","USA","TOP3000","1","0.6641","","","2026-07-16T15:20:39","possible_direction=analyst"
"analyst45","Analyst Trade Ideas","Analyst","anl45_idea_count","anl45_idea_count","Number of ideas in a group, useful when grouping ideas","VECTOR","USA","TOP3000","1","0.6641","","","2026-07-16T15:20:39","possible_direction=analyst"
"analyst45","Analyst Trade Ideas","Analyst","anl45_index_period_end_prc","anl45_index_period_end_prc","Benchmark or index end price for the selected performance period","VECTOR","USA","TOP3000","1","0.587","","","2026-07-16T15:20:39","possible_direction=analyst"
"analyst45","Analyst Trade Ideas","Analyst","anl45_index_period_start_prc","anl45_index_period_start_prc","Benchmark or index start price for the selected performance period","VECTOR","USA","TOP3000","1","0.5925","","","2026-07-16T15:20:39","possible_direction=analyst"
"analyst45","Analyst Trade Ideas","Analyst","anl45_index_ret_per","anl45_index_ret_per","Return percentage had the investment been made in the selected index","VECTOR","USA","TOP3000","1","0.5868","","","2026-07-16T15:20:39","possible_direction=analyst"
"analyst45","Analyst Trade Ideas","Analyst","anl45_initial_inv","anl45_initial_inv","Initial investment amount allocated to the idea","VECTOR","USA","TOP3000","1","0.6641","","","2026-07-16T15:20:39","possible_direction=analyst"
"analyst45","Analyst Trade Ideas","Analyst","anl45_inv_exchange_rate","anl45_inv_exchange_rate","Exchange rate between stock and investment currencies / FX Rate on the period End date","VECTOR","USA","TOP3000","1","0.0043","","","2026-07-16T15:20:39","possible_direction=analyst"
"analyst45","Analyst Trade Ideas","Analyst","anl45_jensensalpha","anl45_jensensalpha","Risk-adjusted performance measure representing return over market","VECTOR","USA","TOP3000","1","0.6025","","","2026-07-16T15:20:39","possible_direction=analyst"
"analyst45","Analyst Trade Ideas","Analyst","anl45_latest_prc","anl45_latest_prc","The current price of the stock in the idea","VECTOR","USA","TOP3000","1","0.4845","","","2026-07-16T15:20:39","possible_direction=analyst"
"analyst45","Analyst Trade Ideas","Analyst","anl45_net_market_exposure","anl45_net_market_exposure","Difference in fractional total value between long and short ideas (net market exposure)","VECTOR","USA","TOP3000","1","0.6639","","","2026-07-16T15:20:39","possible_direction=analyst"
"analyst45","Analyst Trade Ideas","Analyst","anl45_new_value","anl45_new_value","New value set for the stop-loss percent, target price, or capital allocation","VECTOR","USA","TOP3000","1","0.6668","","","2026-07-16T15:20:39","possible_direction=analyst"
"analyst45","Analyst Trade Ideas","Analyst","anl45_old_value","anl45_old_value","Previous value of the stop-loss percent, target price, or capital allocation before the latest change","VECTOR","USA","TOP3000","1","0.6668","","","2026-07-16T15:20:39","possible_direction=analyst"
"analyst45","Analyst Trade Ideas","Analyst","anl45_period_end_prc","anl45_period_end_prc","Close price on day at end of selected period","VECTOR","USA","TOP3000","1","0.5419","","","2026-07-16T15:20:39","possible_direction=analyst"
"analyst45","Analyst Trade Ideas","Analyst","anl45_period_start_prc","anl45_period_start_prc","Close price on day before start of selected period","VECTOR","USA","TOP3000","1","0.5427","","","2026-07-16T15:20:39","possible_direction=analyst"
"analyst45","Analyst Trade Ideas","Analyst","anl45_prc","anl45_prc","The price given to the investment change","VECTOR","USA","TOP3000","1","0.6661","","","2026-07-16T15:20:39","possible_direction=analyst"
"analyst45","Analyst Trade Ideas","Analyst","anl45_prc_change_per_today","anl45_prc_change_per_today","Percent change in stock price since previous close of day price","VECTOR","USA","TOP3000","1","0.5324","","","2026-07-16T15:20:39","possible_direction=analyst"
"analyst45","Analyst Trade Ideas","Analyst","anl45_prc_change_today","anl45_prc_change_today","Change in stock price since previous day close","VECTOR","USA","TOP3000","1","0.5448","","","2026-07-16T15:20:39","possible_direction=analyst"
"analyst45","Analyst Trade Ideas","Analyst","anl45_prev_close_prc","anl45_prev_close_prc","Last available close price for the stock","VECTOR","USA","TOP3000","1","0.5214","","","2026-07-16T15:20:39","possible_direction=analyst"
"analyst45","Analyst Trade Ideas","Analyst","anl45_probability","anl45_probability","Tag giving a quantative measure of conviction","VECTOR","USA","TOP3000","1","0.1347","","","2026-07-16T15:20:39","possible_direction=analyst"
"analyst45","Analyst Trade Ideas","Analyst","anl45_real_ret","anl45_real_ret","Realized return from closed portions of the idea since inception","VECTOR","USA","TOP3000","1","0.5426","","","2026-07-16T15:20:39","possible_direction=analyst"
"analyst45","Analyst Trade Ideas","Analyst","anl45_real_ret_today","anl45_real_ret_today","Increase in realized return since the previous market close","VECTOR","USA","TOP3000","1","0.5225","","","2026-07-16T15:20:39","possible_direction=analyst"
"analyst45","Analyst Trade Ideas","Analyst","anl45_real_value","anl45_real_value","Monetary value of the realized (closed) portion of the idea","VECTOR","USA","TOP3000","1","0.5426","","","2026-07-16T15:20:39","possible_direction=analyst"
"analyst45","Analyst Trade Ideas","Analyst","anl45_rel_index_ret","anl45_rel_index_ret","Difference in return percentage between the idea and the comparative index","VECTOR","USA","TOP3000","1","0.5286","","","2026-07-16T15:20:39","possible_direction=analyst"
"analyst45","Analyst Trade Ideas","Analyst","anl45_rel_index_ret_per","anl45_rel_index_ret_per","Difference in return percentage between the idea and the comparative index","VECTOR","USA","TOP3000","1","0.5409","","","2026-07-16T15:20:39","possible_direction=analyst"
"analyst45","Analyst Trade Ideas","Analyst","anl45_rel_ret_per_today","anl45_rel_ret_per_today","Relative return percentage today","VECTOR","USA","TOP3000","1","0.5201","","","2026-07-16T15:20:39","possible_direction=analyst"
"analyst45","Analyst Trade Ideas","Analyst","anl45_rel_ret_today","anl45_rel_ret_today","Increase in realised return since last market close","VECTOR","USA","TOP3000","1","0.507","","","2026-07-16T15:20:39","possible_direction=analyst"
"analyst45","Analyst Trade Ideas","Analyst","anl45_ret_per_today","anl45_ret_per_today","Percentage return since last market close","VECTOR","USA","TOP3000","1","0.5324","","","2026-07-16T15:20:39","possible_direction=analyst"
"analyst45","Analyst Trade Ideas","Analyst","anl45_ret_today","anl45_ret_today","Increase in realised return since last market close","VECTOR","USA","TOP3000","1","0.5448","","","2026-07-16T15:20:39","possible_direction=analyst"
"analyst45","Analyst Trade Ideas","Analyst","anl45_risk_free_rate","anl45_risk_free_rate","The unrealised return on an open idea","VECTOR","USA","TOP3000","1","0.6653","","","2026-07-16T15:20:39","possible_direction=analyst"
"analyst45","Analyst Trade Ideas","Analyst","anl45_stock_ret_per","anl45_stock_ret_per","Net total return from all ideas since the previous market close","VECTOR","USA","TOP3000","1","0.5418","","","2026-07-16T15:20:39","possible_direction=analyst"
"analyst45","Analyst Trade Ideas","Analyst","anl45_stock_ret_per_relative","anl45_stock_ret_per_relative","Average daily return percentage had the investment been made in the relative benchmark index","VECTOR","USA","TOP3000","1","0.5287","","","2026-07-16T15:20:39","possible_direction=analyst"
"analyst45","Analyst Trade Ideas","Analyst","anl45_target_prc","anl45_target_prc","Author’s stated likely exit price for the idea","VECTOR","USA","TOP3000","1","0.516","","","2026-07-16T15:20:39","possible_direction=analyst"
"analyst45","Analyst Trade Ideas","Analyst","anl45_time","anl45_time","Approximate time horizon for the idea","VECTOR","USA","TOP3000","1","0.667","","","2026-07-16T15:20:39","possible_direction=analyst"
"analyst45","Analyst Trade Ideas","Analyst","anl45_tot_ret","anl45_tot_ret","Sum of realised and unrealised returns","VECTOR","USA","TOP3000","1","0.5419","","","2026-07-16T15:20:39","possible_direction=analyst"
"analyst45","Analyst Trade Ideas","Analyst","anl45_tot_ret_per","anl45_tot_ret_per","Total return as a percentage of average investment","VECTOR","USA","TOP3000","1","0.553","","","2026-07-16T15:20:39","possible_direction=analyst"
"analyst45","Analyst Trade Ideas","Analyst","anl45_tot_ret_wo_fx","anl45_tot_ret_wo_fx","Total return excluding any foreign exchange effects","VECTOR","USA","TOP3000","1","0.5418","","","2026-07-16T15:20:39","possible_direction=analyst"
"analyst45","Analyst Trade Ideas","Analyst","anl45_transaction_charge","anl45_transaction_charge","Transaction fee charged for the idea (in calculation currency)","VECTOR","USA","TOP3000","1","0.667","","","2026-07-16T15:20:39","possible_direction=analyst"
"analyst45","Analyst Trade Ideas","Analyst","anl45_treynor_ratio","anl45_treynor_ratio","A ratio that measures returns earned in excess of that which could have been earned on a riskless investment (such as the risk free rate).??","VECTOR","USA","TOP3000","1","0.6099","","","2026-07-16T15:20:39","possible_direction=analyst"
"analyst45","Analyst Trade Ideas","Analyst","anl45_unreal_ret","anl45_unreal_ret","Unrealized return on the open idea (mark-to-market)","VECTOR","USA","TOP3000","1","0.5419","","","2026-07-16T15:20:39","possible_direction=analyst"
"analyst45","Analyst Trade Ideas","Analyst","anl45_unreal_ret_today","anl45_unreal_ret_today","Increase in unrealised return since the last market close","VECTOR","USA","TOP3000","1","0.5197","","","2026-07-16T15:20:39","possible_direction=analyst"
"analyst45","Analyst Trade Ideas","Analyst","anl45_unreal_value","anl45_unreal_value","Unrealised value of an open idea","VECTOR","USA","TOP3000","1","0.5419","","","2026-07-16T15:20:39","possible_direction=analyst"
"analyst45","Analyst Trade Ideas","Analyst","average_daily_relative_return_percent","average_daily_relative_return_percent","Average daily index relative return percentage","VECTOR","USA","TOP3000","1","0.1946","","","2026-07-16T15:20:39","possible_direction=analyst"
"analyst45","Analyst Trade Ideas","Analyst","average_daily_return_percent","average_daily_return_percent","Average daily percent return over the lifetime of the idea","VECTOR","USA","TOP3000","1","0.2003","","","2026-07-16T15:20:39","possible_direction=analyst"
"analyst45","Analyst Trade Ideas","Analyst","average_idea_duration","average_idea_duration","Average age of the idea (limited to the period selected)","VECTOR","USA","TOP3000","1","0.2491","","","2026-07-16T15:20:39","possible_direction=analyst"
"analyst45","Analyst Trade Ideas","Analyst","average_initial_price_with_fee","average_initial_price_with_fee","The avg initial price adjusted to include fee payment when fees are applied","VECTOR","USA","TOP3000","1","0.1962","","","2026-07-16T15:20:39","possible_direction=analyst"
"analyst45","Analyst Trade Ideas","Analyst","average_initial_trade_price","average_initial_trade_price","Average share price weighted by volume of each share purchase","VECTOR","USA","TOP3000","1","0.1962","","","2026-07-16T15:20:39","possible_direction=analyst"
"analyst45","Analyst Trade Ideas","Analyst","average_investment_amount","average_investment_amount","Time-weighted average investment","VECTOR","USA","TOP3000","1","0.2491","","","2026-07-16T15:20:39","possible_direction=analyst"
"analyst45","Analyst Trade Ideas","Analyst","benchmark_conversion_rate","benchmark_conversion_rate","Exchange rate used to measure/convert the benchmark","VECTOR","USA","TOP3000","1","0.0003","","","2026-07-16T15:20:39","possible_direction=analyst"
"analyst45","Analyst Trade Ideas","Analyst","benchmark_currency_abbreviation","benchmark_currency_abbreviation","Currency of the benchmark","VECTOR","USA","TOP3000","1","0.2499","","","2026-07-16T15:20:39","possible_direction=analyst"
"analyst45","Analyst Trade Ideas","Analyst","benchmark_currency_code","benchmark_currency_code","Currency of the benchmark","VECTOR","USA","TOP3000","1","0.667","","","2026-07-16T15:20:39","possible_direction=analyst"
"analyst45","Analyst Trade Ideas","Analyst","benchmark_fx_return_value","benchmark_fx_return_value","Foreign exchange return attributable to the benchmark (movement due to currency differences)","VECTOR","USA","TOP3000","1","0.2191","","","2026-07-16T15:20:39","possible_direction=analyst"
"analyst45","Analyst Trade Ideas","Analyst","benchmark_index_return_percent","benchmark_index_return_percent","The return percentage of the index over the selected period.","VECTOR","USA","TOP3000","1","0.2044","","","2026-07-16T15:20:39","possible_direction=analyst"
"analyst45","Analyst Trade Ideas","Analyst","benchmark_period_closing_price","benchmark_period_closing_price","The index price at the end of the selected period.","VECTOR","USA","TOP3000","1","0.2084","","","2026-07-16T15:20:39","possible_direction=analyst"
"analyst45","Analyst Trade Ideas","Analyst","benchmark_period_opening_price","benchmark_period_opening_price","The index price at the start of the selected period.","VECTOR","USA","TOP3000","1","0.214","","","2026-07-16T15:20:39","possible_direction=analyst"
"analyst45","Analyst Trade Ideas","Analyst","benchmark_return_ex_fx","benchmark_return_ex_fx","Basically tracking the raw returns of the benchmark","VECTOR","USA","TOP3000","1","0.2105","","","2026-07-16T15:20:39","possible_direction=analyst"
"analyst45","Analyst Trade Ideas","Analyst","benchmark_total_return","benchmark_total_return","Return of the benchmark over the measurement period","VECTOR","USA","TOP3000","1","0.2105","","","2026-07-16T15:20:39","possible_direction=analyst"
"analyst45","Analyst Trade Ideas","Analyst","bias_adjusted_return_value","bias_adjusted_return_value","Non functional field retained for compatibility not used in calculations","VECTOR","USA","TOP3000","1","0.2491","","","2026-07-16T15:20:39","possible_direction=analyst"
"analyst45","Analyst Trade Ideas","Analyst","conversion_rate_summary","conversion_rate_summary","Exchange rate between investment and performance currencies.","VECTOR","USA","TOP3000","1","0.0","","","2026-07-16T15:20:39","possible_direction=analyst"
"analyst45","Analyst Trade Ideas","Analyst","currency_gain_percentage","currency_gain_percentage","The percentage return generated from currency movements.","VECTOR","USA","TOP3000","1","0.0","","","2026-07-16T15:20:39","possible_direction=analyst"
"analyst45","Analyst Trade Ideas","Analyst","currency_gain_value","currency_gain_value","The return generated from currency movements.","VECTOR","USA","TOP3000","1","0.0","","","2026-07-16T15:20:39","possible_direction=analyst"
"analyst45","Analyst Trade Ideas","Analyst","current_investment_amount","current_investment_amount","Current investment amount of the idea, including all increases and partial closures","VECTOR","USA","TOP3000","1","0.2491","","","2026-07-16T15:20:39","possible_direction=analyst"
"analyst45","Analyst Trade Ideas","Analyst","daily_price_change_percent","daily_price_change_percent","The percentage change in price since the previous day's close.","VECTOR","USA","TOP3000","1","0.1922","","","2026-07-16T15:20:39","possible_direction=analyst"
"analyst45","Analyst Trade Ideas","Analyst","daily_price_delta","daily_price_delta","The change in the security's price since the previous market close.","VECTOR","USA","TOP3000","1","0.1962","","","2026-07-16T15:20:39","possible_direction=analyst"
"analyst45","Analyst Trade Ideas","Analyst","daily_unrealized_gain","daily_unrealized_gain","The increase in unrealized return since the last market close.","VECTOR","USA","TOP3000","1","0.1872","","","2026-07-16T15:20:39","possible_direction=analyst"
"analyst45","Analyst Trade Ideas","Analyst","days_since_idea_start","days_since_idea_start","Number of trading days since the idea was submitted","VECTOR","USA","TOP3000","1","0.2499","","","2026-07-16T15:20:39","possible_direction=analyst"
"analyst45","Analyst Trade Ideas","Analyst","entry_price_inclusive_fees","entry_price_inclusive_fees","The average initial price adjusted for transaction fees.","VECTOR","USA","TOP3000","1","0.1959","","","2026-07-16T15:20:39","possible_direction=analyst"
"analyst45","Analyst Trade Ideas","Analyst","event_associated_price","event_associated_price","The price associated with an investment change or event.","VECTOR","USA","TOP3000","1","0.2493","","","2026-07-16T15:20:39","possible_direction=analyst"
"analyst45","Analyst Trade Ideas","Analyst","expected_exit_price_2","expected_exit_price_2","The projected price at which the contributor expects to close the position.","VECTOR","USA","TOP3000","1","0.0589","","","2026-07-16T15:20:39","possible_direction=analyst"
"analyst45","Analyst Trade Ideas","Analyst","expected_exit_price_3","expected_exit_price_3","Author’s likely exit price for the idea","VECTOR","USA","TOP3000","1","0.0589","","","2026-07-16T15:20:39","possible_direction=analyst"
"analyst45","Analyst Trade Ideas","Analyst","final_closing_price","final_closing_price","The price at which the trade idea was closed or exited.","VECTOR","USA","TOP3000","1","0.1662","","","2026-07-16T15:20:39","possible_direction=analyst"
"analyst45","Analyst Trade Ideas","Analyst","foreign_exchange_gain","foreign_exchange_gain","The return generated from foreign exchange rate changes.","VECTOR","USA","TOP3000","1","0.0","","","2026-07-16T15:20:39","possible_direction=analyst"
"analyst45","Analyst Trade Ideas","Analyst","foreign_exchange_return_value","foreign_exchange_return_value","Return generated from variations in foreign exchange rates affecting the idea's PnL","VECTOR","USA","TOP3000","1","0.5463","","","2026-07-16T15:20:39","possible_direction=analyst"
"analyst45","Analyst Trade Ideas","Analyst","fx_gain_percentage","fx_gain_percentage","The percentage return generated from foreign exchange rate movements.","VECTOR","USA","TOP3000","1","0.0","","","2026-07-16T15:20:39","possible_direction=analyst"
"analyst45","Analyst Trade Ideas","Analyst","fx_return_percentage","fx_return_percentage","Return from FX movements expressed as a percentage of the investment","VECTOR","USA","TOP3000","1","0.5463","","","2026-07-16T15:20:39","possible_direction=analyst"
"analyst45","Analyst Trade Ideas","Analyst","gain_percent_today","gain_percent_today","The percentage return for the idea since the last market close.","VECTOR","USA","TOP3000","1","0.1922","","","2026-07-16T15:20:39","possible_direction=analyst"
"analyst45","Analyst Trade Ideas","Analyst","grouped_idea_total","grouped_idea_total","The number of ideas in a group or view.","VECTOR","USA","TOP3000","1","0.2491","","","2026-07-16T15:20:39","possible_direction=analyst"
"analyst45","Analyst Trade Ideas","Analyst","index_period_ending_price","index_period_ending_price","Benchmark/Index end price based on the performance period you chose","VECTOR","USA","TOP3000","1","0.2131","","","2026-07-16T15:20:39","possible_direction=analyst"
"analyst45","Analyst Trade Ideas","Analyst","index_period_starting_price","index_period_starting_price","Benchmark/Index start price based on the performance period you chose","VECTOR","USA","TOP3000","1","0.2169","","","2026-07-16T15:20:39","possible_direction=analyst"
"analyst45","Analyst Trade Ideas","Analyst","index_return_percentage","index_return_percentage","Return percentage had the investment been made in the comparative index","VECTOR","USA","TOP3000","1","0.2142","","","2026-07-16T15:20:39","possible_direction=analyst"
"analyst45","Analyst Trade Ideas","Analyst","investment_conversion_rate","investment_conversion_rate","Exchange rate between stock and investment currencies, i.e., FX rate on the period end date","VECTOR","USA","TOP3000","1","0.0003","","","2026-07-16T15:20:39","possible_direction=analyst"
"analyst45","Analyst Trade Ideas","Analyst","investment_currency_abbreviation","investment_currency_abbreviation","Currency of the idea investment","VECTOR","USA","TOP3000","1","0.2499","","","2026-07-16T15:20:39","possible_direction=analyst"
"analyst45","Analyst Trade Ideas","Analyst","investment_currency_code","investment_currency_code","Currency of the investment","VECTOR","USA","TOP3000","1","0.667","","","2026-07-16T15:20:39","possible_direction=analyst"
"analyst45","Analyst Trade Ideas","Analyst","investment_fx_conversion_rate","investment_fx_conversion_rate","The exchange rate between stock and investment currencies.","VECTOR","USA","TOP3000","1","0.0003","","","2026-07-16T15:20:39","possible_direction=analyst"
