dataset_id,dataset_name,dataset_category,field_id,field_name,description,field_type,region,universe,delay,coverage,user_permission,permission_level,last_seen,notes,keywords
fundamental72,Comprehensive Fundamental Data,Fundamental,fnd72_s_pit_or_bs_q_2_invtry_raw_materials,fnd72_s_pit_or_bs_q_2_invtry_raw_materials,Value of raw materials component of inventory,MATRIX,USA,TOP3000,1,0.5873,,,2026-07-16T15:20:39,possible_direction=fundamental,component comprehensive data fnd72_s_pit_or_bs_q_2_invtry_raw_materials fundamental fundamental72 inventory materials possible_direction raw value
fundamental72,Comprehensive Fundamental Data,Fundamental,fnd72_s_pit_or_bs_q_2_latest_period_end_dt_full_record,fnd72_s_pit_or_bs_q_2_latest_period_end_dt_full_record,Latest available period end date from full financial records,MATRIX,USA,TOP3000,1,0.9049,,,2026-07-16T15:20:39,possible_direction=fundamental,available comprehensive data date end financial fnd72_s_pit_or_bs_q_2_latest_period_end_dt_full_record from full fundamental fundamental72 latest period possible_direction records
fundamental72,Comprehensive Fundamental Data,Fundamental,fnd72_s_pit_or_bs_q_2_lt_capital_lease_obligations,fnd72_s_pit_or_bs_q_2_lt_capital_lease_obligations,Long-term obligations under capital/finance leases due beyond one year,MATRIX,USA,TOP3000,1,0.408,,,2026-07-16T15:20:39,possible_direction=fundamental,beyond capital comprehensive data due finance fnd72_s_pit_or_bs_q_2_lt_capital_lease_obligations fundamental fundamental72 leases long obligations one possible_direction term under year
fundamental72,Comprehensive Fundamental Data,Fundamental,fnd72_s_pit_or_bs_q_2_num_outlets_branches,fnd72_s_pit_or_bs_q_2_num_outlets_branches,Number of outlets and branches,MATRIX,USA,TOP3000,1,0.692,,,2026-07-16T15:20:39,possible_direction=fundamental,branches comprehensive data fnd72_s_pit_or_bs_q_2_num_outlets_branches fundamental fundamental72 number outlets possible_direction
fundamental72,Comprehensive Fundamental Data,Fundamental,fnd72_s_pit_or_bs_q_2_st_capital_lease_obligations,fnd72_s_pit_or_bs_q_2_st_capital_lease_obligations,Current portion of capital lease obligations due within one year,MATRIX,USA,TOP3000,1,0.3816,,,2026-07-16T15:20:39,possible_direction=fundamental,capital comprehensive current data due fnd72_s_pit_or_bs_q_2_st_capital_lease_obligations fundamental fundamental72 lease obligations one portion possible_direction within year
fundamental72,Comprehensive Fundamental Data,Fundamental,fnd72_s_pit_or_bs_q_announcement_dt,fnd72_s_pit_or_bs_q_announcement_dt,Latest earnings announcement date for which full fundamental information is available for the quarter,MATRIX,USA,TOP3000,1,0.9049,,,2026-07-16T15:20:39,possible_direction=fundamental,announcement available comprehensive data date earnings fnd72_s_pit_or_bs_q_announcement_dt full fundamental fundamental72 information is latest possible_direction quarter which
fundamental72,Comprehensive Fundamental Data,Fundamental,fnd72_s_pit_or_bs_q_bs_accrual,fnd72_s_pit_or_bs_q_bs_accrual,Other accounts payable and accrued liabilities for the quarter,MATRIX,USA,TOP3000,1,0.7005,,,2026-07-16T15:20:39,possible_direction=fundamental,accounts accrued comprehensive data fnd72_s_pit_or_bs_q_bs_accrual fundamental fundamental72 liabilities other payable possible_direction quarter
fundamental72,Comprehensive Fundamental Data,Fundamental,fnd72_s_pit_or_bs_q_bs_accrued_income_taxes,fnd72_s_pit_or_bs_q_bs_accrued_income_taxes,Accrued income taxes payable,MATRIX,USA,TOP3000,1,0.3369,,,2026-07-16T15:20:39,possible_direction=fundamental,accrued comprehensive data fnd72_s_pit_or_bs_q_bs_accrued_income_taxes fundamental fundamental72 income payable possible_direction taxes
fundamental72,Comprehensive Fundamental Data,Fundamental,fnd72_s_pit_or_bs_q_bs_acct_note_rcv,fnd72_s_pit_or_bs_q_bs_acct_note_rcv,Accounts and notes receivable reported on the balance sheet for the quarter,MATRIX,USA,TOP3000,1,0.8243,,,2026-07-16T15:20:39,possible_direction=fundamental,accounts balance comprehensive data fnd72_s_pit_or_bs_q_bs_acct_note_rcv fundamental fundamental72 notes possible_direction quarter receivable reported sheet
fundamental72,Comprehensive Fundamental Data,Fundamental,fnd72_s_pit_or_bs_q_bs_acct_payable,fnd72_s_pit_or_bs_q_bs_acct_payable,Amounts owed to suppliers or vendors for goods and services received; standard accounts payable liability,MATRIX,USA,TOP3000,1,0.7456,,,2026-07-16T15:20:39,possible_direction=fundamental,accounts amounts comprehensive data fnd72_s_pit_or_bs_q_bs_acct_payable fundamental fundamental72 goods liability owed payable possible_direction received services standard suppliers vendors
fundamental72,Comprehensive Fundamental Data,Fundamental,fnd72_s_pit_or_bs_q_bs_accts_rec_excl_notes_rec,fnd72_s_pit_or_bs_q_bs_accts_rec_excl_notes_rec,"Trade accounts receivable excluding notes, net of allowances",MATRIX,USA,TOP3000,1,0.7476,,,2026-07-16T15:20:39,possible_direction=fundamental,accounts allowances comprehensive data excluding fnd72_s_pit_or_bs_q_bs_accts_rec_excl_notes_rec fundamental fundamental72 net notes possible_direction receivable trade
fundamental72,Comprehensive Fundamental Data,Fundamental,fnd72_s_pit_or_bs_q_bs_accum_depr,fnd72_s_pit_or_bs_q_bs_accum_depr,"Cumulative depreciation on property, plant and equipment",MATRIX,USA,TOP3000,1,0.6171,,,2026-07-16T15:20:39,possible_direction=fundamental,comprehensive cumulative data depreciation equipment fnd72_s_pit_or_bs_q_bs_accum_depr fundamental fundamental72 plant possible_direction property
fundamental72,Comprehensive Fundamental Data,Fundamental,fnd72_s_pit_or_bs_q_bs_add_paid_in_cap,fnd72_s_pit_or_bs_q_bs_add_paid_in_cap,Additional paid-in capital (share premium over par value),MATRIX,USA,TOP3000,1,0.8143,,,2026-07-16T15:20:39,possible_direction=fundamental,additional capital comprehensive data fnd72_s_pit_or_bs_q_bs_add_paid_in_cap fundamental fundamental72 over paid par possible_direction premium share value
fundamental72,Comprehensive Fundamental Data,Fundamental,fnd72_s_pit_or_bs_q_bs_allow_doubtful_acc_rec,fnd72_s_pit_or_bs_q_bs_allow_doubtful_acc_rec,Allowance for doubtful accounts (credit loss reserve on receivables) for the quarter,MATRIX,USA,TOP3000,1,0.4446,,,2026-07-16T15:20:39,possible_direction=fundamental,accounts allowance comprehensive credit data doubtful fnd72_s_pit_or_bs_q_bs_allow_doubtful_acc_rec fundamental fundamental72 loss possible_direction quarter receivables reserve
fundamental72,Comprehensive Fundamental Data,Fundamental,fnd72_s_pit_or_bs_q_bs_amt_of_tsy_stock,fnd72_s_pit_or_bs_q_bs_amt_of_tsy_stock,Monetary amount/carrying value of treasury stock,MATRIX,USA,TOP3000,1,0.8777,,,2026-07-16T15:20:39,possible_direction=fundamental,amount carrying comprehensive data fnd72_s_pit_or_bs_q_bs_amt_of_tsy_stock fundamental fundamental72 monetary possible_direction stock treasury value
fundamental72,Comprehensive Fundamental Data,Fundamental,fnd72_s_pit_or_bs_q_bs_capital_reserve,fnd72_s_pit_or_bs_q_bs_capital_reserve,"Capital reserve (e.g., share premium or other paid-in capital)",MATRIX,USA,TOP3000,1,0.7922,,,2026-07-16T15:20:39,possible_direction=fundamental,capital comprehensive data fnd72_s_pit_or_bs_q_bs_capital_reserve fundamental fundamental72 other paid possible_direction premium reserve share
fundamental72,Comprehensive Fundamental Data,Fundamental,fnd72_s_pit_or_bs_q_bs_cash_near_cash_item,fnd72_s_pit_or_bs_q_bs_cash_near_cash_item,Cash and cash equivalents,MATRIX,USA,TOP3000,1,0.9048,,,2026-07-16T15:20:39,possible_direction=fundamental,cash comprehensive data equivalents fnd72_s_pit_or_bs_q_bs_cash_near_cash_item fundamental fundamental72 possible_direction
fundamental72,Comprehensive Fundamental Data,Fundamental,fnd72_s_pit_or_bs_q_bs_common_stock,fnd72_s_pit_or_bs_q_bs_common_stock,"Quarterly value of common stock, generally calculated as par or stated value times shares issued",MATRIX,USA,TOP3000,1,0.8354,,,2026-07-16T15:20:39,possible_direction=fundamental,as calculated common comprehensive data fnd72_s_pit_or_bs_q_bs_common_stock fundamental fundamental72 generally issued par possible_direction quarterly shares stated stock times value
fundamental72,Comprehensive Fundamental Data,Fundamental,fnd72_s_pit_or_bs_q_bs_cur_asset_report,fnd72_s_pit_or_bs_q_bs_cur_asset_report,Total current assets,MATRIX,USA,TOP3000,1,0.7377,,,2026-07-16T15:20:39,possible_direction=fundamental,assets comprehensive current data fnd72_s_pit_or_bs_q_bs_cur_asset_report fundamental fundamental72 possible_direction total
fundamental72,Comprehensive Fundamental Data,Fundamental,fnd72_s_pit_or_bs_q_bs_cur_liab,fnd72_s_pit_or_bs_q_bs_cur_liab,Total current liabilities,MATRIX,USA,TOP3000,1,0.7387,,,2026-07-16T15:20:39,possible_direction=fundamental,comprehensive current data fnd72_s_pit_or_bs_q_bs_cur_liab fundamental fundamental72 liabilities possible_direction total
fundamental72,Comprehensive Fundamental Data,Fundamental,fnd72_s_pit_or_bs_q_bs_def_tax_liab,fnd72_s_pit_or_bs_q_bs_def_tax_liab,"Net deferred tax liabilities, long-term portion",MATRIX,USA,TOP3000,1,0.4782,,,2026-07-16T15:20:39,possible_direction=fundamental,comprehensive data deferred fnd72_s_pit_or_bs_q_bs_def_tax_liab fundamental fundamental72 liabilities long net portion possible_direction tax term
fundamental72,Comprehensive Fundamental Data,Fundamental,fnd72_s_pit_or_bs_q_bs_disclosed_intangibles,fnd72_s_pit_or_bs_q_bs_disclosed_intangibles,"Total amount of disclosed intangible assets (e.g., goodwill, patents, copyrights) reported in the balance sheet",MATRIX,USA,TOP3000,1,0.8491,,,2026-07-16T15:20:39,possible_direction=fundamental,amount assets balance comprehensive copyrights data disclosed fnd72_s_pit_or_bs_q_bs_disclosed_intangibles fundamental fundamental72 goodwill intangible patents possible_direction reported sheet total
fundamental72,Comprehensive Fundamental Data,Fundamental,fnd72_s_pit_or_bs_q_bs_future_min_oper_lease_oblig,fnd72_s_pit_or_bs_q_bs_future_min_oper_lease_oblig,Future minimum operating lease obligations disclosed for the quarter,MATRIX,USA,TOP3000,1,0.588,,,2026-07-16T15:20:39,possible_direction=fundamental,comprehensive data disclosed fnd72_s_pit_or_bs_q_bs_future_min_oper_lease_oblig fundamental fundamental72 future lease minimum obligations operating possible_direction quarter
fundamental72,Comprehensive Fundamental Data,Fundamental,fnd72_s_pit_or_bs_q_bs_fv_assets_rec_level_1,fnd72_s_pit_or_bs_q_bs_fv_assets_rec_level_1,Assets measured at fair value on a recurring basis using Level 1 inputs,MATRIX,USA,TOP3000,1,0.6203,,,2026-07-16T15:20:39,possible_direction=fundamental,assets at basis comprehensive data fair fnd72_s_pit_or_bs_q_bs_fv_assets_rec_level_1 fundamental fundamental72 inputs level measured possible_direction recurring using value
fundamental72,Comprehensive Fundamental Data,Fundamental,fnd72_s_pit_or_bs_q_bs_goodwill,fnd72_s_pit_or_bs_q_bs_goodwill,Goodwill,MATRIX,USA,TOP3000,1,0.7777,,,2026-07-16T15:20:39,possible_direction=fundamental,comprehensive data fnd72_s_pit_or_bs_q_bs_goodwill fundamental fundamental72 goodwill possible_direction
fundamental72,Comprehensive Fundamental Data,Fundamental,fnd72_s_pit_or_bs_q_bs_gross_fix_asset,fnd72_s_pit_or_bs_q_bs_gross_fix_asset,Gross Fixed Assets,MATRIX,USA,TOP3000,1,0.6076,,,2026-07-16T15:20:39,possible_direction=fundamental,assets comprehensive data fixed fnd72_s_pit_or_bs_q_bs_gross_fix_asset fundamental fundamental72 gross possible_direction
fundamental72,Comprehensive Fundamental Data,Fundamental,fnd72_s_pit_or_bs_q_bs_inventories,fnd72_s_pit_or_bs_q_bs_inventories,Value of inventories on the balance sheet,MATRIX,USA,TOP3000,1,0.7364,,,2026-07-16T15:20:39,possible_direction=fundamental,balance comprehensive data fnd72_s_pit_or_bs_q_bs_inventories fundamental fundamental72 inventories possible_direction sheet value
fundamental72,Comprehensive Fundamental Data,Fundamental,fnd72_s_pit_or_bs_q_bs_lifo_reserve,fnd72_s_pit_or_bs_q_bs_lifo_reserve,Difference between inventory under LIFO accounting and if FIFO had been used; reflects impact of inventory accounting method,MATRIX,USA,TOP3000,1,0.6239,,,2026-07-16T15:20:39,possible_direction=fundamental,accounting been between comprehensive data difference fifo fnd72_s_pit_or_bs_q_bs_lifo_reserve fundamental fundamental72 had if impact inventory lifo method possible_direction reflects under used
fundamental72,Comprehensive Fundamental Data,Fundamental,fnd72_s_pit_or_bs_q_bs_lt_borrow,fnd72_s_pit_or_bs_q_bs_lt_borrow,Debt obligations due beyond one year,MATRIX,USA,TOP3000,1,0.9041,,,2026-07-16T15:20:39,possible_direction=fundamental,beyond comprehensive data debt due fnd72_s_pit_or_bs_q_bs_lt_borrow fundamental fundamental72 obligations one possible_direction year
fundamental72,Comprehensive Fundamental Data,Fundamental,fnd72_s_pit_or_bs_q_bs_lt_invest,fnd72_s_pit_or_bs_q_bs_lt_invest,Long-term investments and receivables reported on the balance sheet for the quarter,MATRIX,USA,TOP3000,1,0.8718,,,2026-07-16T15:20:39,possible_direction=fundamental,balance comprehensive data fnd72_s_pit_or_bs_q_bs_lt_invest fundamental fundamental72 investments long possible_direction quarter receivables reported sheet term
fundamental72,Comprehensive Fundamental Data,Fundamental,fnd72_s_pit_or_bs_q_bs_mkt_sec_other_st_invest,fnd72_s_pit_or_bs_q_bs_mkt_sec_other_st_invest,Balance sheet value of marketable securities and other short-term investments,MATRIX,USA,TOP3000,1,0.8966,,,2026-07-16T15:20:39,possible_direction=fundamental,balance comprehensive data fnd72_s_pit_or_bs_q_bs_mkt_sec_other_st_invest fundamental fundamental72 investments marketable other possible_direction securities sheet short term value
fundamental72,Comprehensive Fundamental Data,Fundamental,fnd72_s_pit_or_bs_q_bs_net_fix_asset,fnd72_s_pit_or_bs_q_bs_net_fix_asset,Net Fixed Assets,MATRIX,USA,TOP3000,1,0.943,,,2026-07-16T15:20:39,possible_direction=fundamental,assets comprehensive data fixed fnd72_s_pit_or_bs_q_bs_net_fix_asset fundamental fundamental72 net possible_direction
fundamental72,Comprehensive Fundamental Data,Fundamental,fnd72_s_pit_or_bs_q_bs_non_depr_decomm_fund,fnd72_s_pit_or_bs_q_bs_non_depr_decomm_fund,Non-depreciable fixed assets and decommissioning funds,MATRIX,USA,TOP3000,1,0.3784,,,2026-07-16T15:20:39,possible_direction=fundamental,assets comprehensive data decommissioning depreciable fixed fnd72_s_pit_or_bs_q_bs_non_depr_decomm_fund fundamental fundamental72 funds non possible_direction
fundamental72,Comprehensive Fundamental Data,Fundamental,fnd72_s_pit_or_bs_q_bs_options_granted,fnd72_s_pit_or_bs_q_bs_options_granted,Number of stock options granted during the period to employees or management as part of compensation plans,MATRIX,USA,TOP3000,1,0.3255,,,2026-07-16T15:20:39,possible_direction=fundamental,as compensation comprehensive data during employees fnd72_s_pit_or_bs_q_bs_options_granted fundamental fundamental72 granted management number options part period plans possible_direction stock
fundamental72,Comprehensive Fundamental Data,Fundamental,fnd72_s_pit_or_bs_q_bs_options_outstanding,fnd72_s_pit_or_bs_q_bs_options_outstanding,Number of shares under stock option plans outstanding at the end of the period,MATRIX,USA,TOP3000,1,0.4954,,,2026-07-16T15:20:39,possible_direction=fundamental,at comprehensive data end fnd72_s_pit_or_bs_q_bs_options_outstanding fundamental fundamental72 number option outstanding period plans possible_direction shares stock under
fundamental72,Comprehensive Fundamental Data,Fundamental,fnd72_s_pit_or_bs_q_bs_other_asset_def_chng_other,fnd72_s_pit_or_bs_q_bs_other_asset_def_chng_other,Miscellaneous long-term (non-current) assets not otherwise classified,MATRIX,USA,TOP3000,1,0.904,,,2026-07-16T15:20:39,possible_direction=fundamental,assets classified comprehensive current data fnd72_s_pit_or_bs_q_bs_other_asset_def_chng_other fundamental fundamental72 long miscellaneous non not otherwise possible_direction term
fundamental72,Comprehensive Fundamental Data,Fundamental,fnd72_s_pit_or_bs_q_bs_other_cur_asset,fnd72_s_pit_or_bs_q_bs_other_cur_asset,Other current assets not separately itemized,MATRIX,USA,TOP3000,1,0.7365,,,2026-07-16T15:20:39,possible_direction=fundamental,assets comprehensive current data fnd72_s_pit_or_bs_q_bs_other_cur_asset fundamental fundamental72 itemized not other possible_direction separately
fundamental72,Comprehensive Fundamental Data,Fundamental,fnd72_s_pit_or_bs_q_bs_other_cur_asset_less_prepay,fnd72_s_pit_or_bs_q_bs_other_cur_asset_less_prepay,Other current assets excluding prepayments,MATRIX,USA,TOP3000,1,0.7331,,,2026-07-16T15:20:39,possible_direction=fundamental,assets comprehensive current data excluding fnd72_s_pit_or_bs_q_bs_other_cur_asset_less_prepay fundamental fundamental72 other possible_direction prepayments
fundamental72,Comprehensive Fundamental Data,Fundamental,fnd72_s_pit_or_bs_q_bs_other_cur_liab,fnd72_s_pit_or_bs_q_bs_other_cur_liab,"Miscellaneous short-term liabilities on the balance sheet, including customer deposits, deferred taxes, refunds, or other current obligations not separately classified",MATRIX,USA,TOP3000,1,0.7322,,,2026-07-16T15:20:39,possible_direction=fundamental,balance classified comprehensive current customer data deferred deposits fnd72_s_pit_or_bs_q_bs_other_cur_liab fundamental fundamental72 including liabilities miscellaneous not obligations other possible_direction refunds separately sheet short taxes term
fundamental72,Comprehensive Fundamental Data,Fundamental,fnd72_s_pit_or_bs_q_bs_other_inv,fnd72_s_pit_or_bs_q_bs_other_inv,Quarterly value of other inventory/allowances not otherwise classified,MATRIX,USA,TOP3000,1,0.5853,,,2026-07-16T15:20:39,possible_direction=fundamental,allowances classified comprehensive data fnd72_s_pit_or_bs_q_bs_other_inv fundamental fundamental72 inventory not other otherwise possible_direction quarterly value
fundamental72,Comprehensive Fundamental Data,Fundamental,fnd72_s_pit_or_bs_q_bs_other_lt_liabilities,fnd72_s_pit_or_bs_q_bs_other_lt_liabilities,Other long-term liabilities not classified elsewhere,MATRIX,USA,TOP3000,1,0.8741,,,2026-07-16T15:20:39,possible_direction=fundamental,classified comprehensive data elsewhere fnd72_s_pit_or_bs_q_bs_other_lt_liabilities fundamental fundamental72 liabilities long not other possible_direction term
fundamental72,Comprehensive Fundamental Data,Fundamental,fnd72_s_pit_or_bs_q_bs_other_st_liab,fnd72_s_pit_or_bs_q_bs_other_st_liab,Other short-term liabilities,MATRIX,USA,TOP3000,1,0.878,,,2026-07-16T15:20:39,possible_direction=fundamental,comprehensive data fnd72_s_pit_or_bs_q_bs_other_st_liab fundamental fundamental72 liabilities other possible_direction short term
fundamental72,Comprehensive Fundamental Data,Fundamental,fnd72_s_pit_or_bs_q_bs_par_val,fnd72_s_pit_or_bs_q_bs_par_val,Par value of issued share capital,MATRIX,USA,TOP3000,1,0.8424,,,2026-07-16T15:20:39,possible_direction=fundamental,capital comprehensive data fnd72_s_pit_or_bs_q_bs_par_val fundamental fundamental72 issued par possible_direction share value
fundamental72,Comprehensive Fundamental Data,Fundamental,fnd72_s_pit_or_bs_q_bs_pension_rsrv,fnd72_s_pit_or_bs_q_bs_pension_rsrv,Balance of pension and post-retirement obligations and reserves (long-term provisions and severance payments),MATRIX,USA,TOP3000,1,0.6834,,,2026-07-16T15:20:39,possible_direction=fundamental,balance comprehensive data fnd72_s_pit_or_bs_q_bs_pension_rsrv fundamental fundamental72 long obligations payments pension possible_direction post provisions reserves retirement severance term
fundamental72,Comprehensive Fundamental Data,Fundamental,fnd72_s_pit_or_bs_q_bs_pure_retained_earnings,fnd72_s_pit_or_bs_q_bs_pure_retained_earnings,"Retained earnings: accumulated earnings retained in the company after dividends, possibly including legal reserves and current year profit",MATRIX,USA,TOP3000,1,0.8922,,,2026-07-16T15:20:39,possible_direction=fundamental,accumulated after company comprehensive current data dividends earnings fnd72_s_pit_or_bs_q_bs_pure_retained_earnings fundamental fundamental72 including legal possible_direction possibly profit reserves retained year
fundamental72,Comprehensive Fundamental Data,Fundamental,fnd72_s_pit_or_bs_q_bs_rental_exp_beyond_year_5,fnd72_s_pit_or_bs_q_bs_rental_exp_beyond_year_5,Operating lease payments due in year 6 and beyond,MATRIX,USA,TOP3000,1,0.5376,,,2026-07-16T15:20:39,possible_direction=fundamental,beyond comprehensive data due fnd72_s_pit_or_bs_q_bs_rental_exp_beyond_year_5 fundamental fundamental72 lease operating payments possible_direction year
fundamental72,Comprehensive Fundamental Data,Fundamental,fnd72_s_pit_or_bs_q_bs_rental_exp_year_1,fnd72_s_pit_or_bs_q_bs_rental_exp_year_1,Minimum operating lease payments due within one year,MATRIX,USA,TOP3000,1,0.564,,,2026-07-16T15:20:39,possible_direction=fundamental,comprehensive data due fnd72_s_pit_or_bs_q_bs_rental_exp_year_1 fundamental fundamental72 lease minimum one operating payments possible_direction within year
fundamental72,Comprehensive Fundamental Data,Fundamental,fnd72_s_pit_or_bs_q_bs_rental_exp_year_2,fnd72_s_pit_or_bs_q_bs_rental_exp_year_2,"Operating lease payments due in year 2, as disclosed in the quarterly schedule",MATRIX,USA,TOP3000,1,0.5289,,,2026-07-16T15:20:39,possible_direction=fundamental,as comprehensive data disclosed due fnd72_s_pit_or_bs_q_bs_rental_exp_year_2 fundamental fundamental72 lease operating payments possible_direction quarterly schedule year
fundamental72,Comprehensive Fundamental Data,Fundamental,fnd72_s_pit_or_bs_q_bs_rental_exp_year_3,fnd72_s_pit_or_bs_q_bs_rental_exp_year_3,Operating lease payments due in year 3 (rental commitments),MATRIX,USA,TOP3000,1,0.5267,,,2026-07-16T15:20:39,possible_direction=fundamental,commitments comprehensive data due fnd72_s_pit_or_bs_q_bs_rental_exp_year_3 fundamental fundamental72 lease operating payments possible_direction rental year
fundamental72,Comprehensive Fundamental Data,Fundamental,fnd72_s_pit_or_bs_q_bs_rental_exp_year_4,fnd72_s_pit_or_bs_q_bs_rental_exp_year_4,Operating lease payments due in year 4,MATRIX,USA,TOP3000,1,0.5209,,,2026-07-16T15:20:39,possible_direction=fundamental,comprehensive data due fnd72_s_pit_or_bs_q_bs_rental_exp_year_4 fundamental fundamental72 lease operating payments possible_direction year
fundamental72,Comprehensive Fundamental Data,Fundamental,fnd72_s_pit_or_bs_q_bs_rental_exp_year_5,fnd72_s_pit_or_bs_q_bs_rental_exp_year_5,"Operating lease payments due in year 5, as disclosed in the quarterly schedule",MATRIX,USA,TOP3000,1,0.5076,,,2026-07-16T15:20:39,possible_direction=fundamental,as comprehensive data disclosed due fnd72_s_pit_or_bs_q_bs_rental_exp_year_5 fundamental fundamental72 lease operating payments possible_direction quarterly schedule year
fundamental72,Comprehensive Fundamental Data,Fundamental,fnd72_s_pit_or_bs_q_bs_retain_earn,fnd72_s_pit_or_bs_q_bs_retain_earn,The cumulative undistributed earnings and comprehensive equity accumulated by the company,MATRIX,USA,TOP3000,1,0.9042,,,2026-07-16T15:20:39,possible_direction=fundamental,accumulated by company comprehensive cumulative data earnings equity fnd72_s_pit_or_bs_q_bs_retain_earn fundamental fundamental72 possible_direction undistributed
fundamental72,Comprehensive Fundamental Data,Fundamental,fnd72_s_pit_or_bs_q_bs_sh_cap_and_apic,fnd72_s_pit_or_bs_q_bs_sh_cap_and_apic,Total share capital and additional paid-in-capital reported on the balance sheet,MATRIX,USA,TOP3000,1,0.9012,,,2026-07-16T15:20:39,possible_direction=fundamental,additional balance capital comprehensive data fnd72_s_pit_or_bs_q_bs_sh_cap_and_apic fundamental fundamental72 paid possible_direction reported share sheet total
fundamental72,Comprehensive Fundamental Data,Fundamental,fnd72_s_pit_or_bs_q_bs_sh_out,fnd72_s_pit_or_bs_q_bs_sh_out,Total number of shares outstanding at period end (excluding treasury shares),MATRIX,USA,TOP3000,1,0.9038,,,2026-07-16T15:20:39,possible_direction=fundamental,at comprehensive data end excluding fnd72_s_pit_or_bs_q_bs_sh_out fundamental fundamental72 number outstanding period possible_direction shares total treasury
fundamental72,Comprehensive Fundamental Data,Fundamental,fnd72_s_pit_or_bs_q_bs_st_borrow,fnd72_s_pit_or_bs_q_bs_st_borrow,Short-term borrowings/debt for the quarter,MATRIX,USA,TOP3000,1,0.8896,,,2026-07-16T15:20:39,possible_direction=fundamental,borrowings comprehensive data debt fnd72_s_pit_or_bs_q_bs_st_borrow fundamental fundamental72 possible_direction quarter short term
fundamental72,Comprehensive Fundamental Data,Fundamental,fnd72_s_pit_or_bs_q_bs_st_debt,fnd72_s_pit_or_bs_q_bs_st_debt,Short-term borrowings and current portion of long-term debt,MATRIX,USA,TOP3000,1,0.6344,,,2026-07-16T15:20:39,possible_direction=fundamental,borrowings comprehensive current data debt fnd72_s_pit_or_bs_q_bs_st_debt fundamental fundamental72 long portion possible_direction short term
fundamental72,Comprehensive Fundamental Data,Fundamental,fnd72_s_pit_or_bs_q_bs_st_portion_of_lt_debt,fnd72_s_pit_or_bs_q_bs_st_portion_of_lt_debt,Short-term portion of long-term debt due within one year,MATRIX,USA,TOP3000,1,0.6315,,,2026-07-16T15:20:39,possible_direction=fundamental,comprehensive data debt due fnd72_s_pit_or_bs_q_bs_st_portion_of_lt_debt fundamental fundamental72 long one portion possible_direction short term within year
fundamental72,Comprehensive Fundamental Data,Fundamental,fnd72_s_pit_or_bs_q_bs_tot_asset,fnd72_s_pit_or_bs_q_bs_tot_asset,Total assets reported on the balance sheet for the quarter,MATRIX,USA,TOP3000,1,0.9048,,,2026-07-16T15:20:39,possible_direction=fundamental,assets balance comprehensive data fnd72_s_pit_or_bs_q_bs_tot_asset fundamental fundamental72 possible_direction quarter reported sheet total
