dataset_id,dataset_name,dataset_category,field_id,field_name,description,field_type,region,universe,delay,coverage,user_permission,permission_level,last_seen,notes,keywords
fundamental72,Comprehensive Fundamental Data,Fundamental,fnd72_pit_or_is_a_is_oprb_expense_income,fnd72_pit_or_is_a_is_oprb_expense_income,Net amount of other post-employment benefits cost that is recognized in the income statement,VECTOR,USA,TOP3000,1,0.6517,,,2026-07-16T15:20:39,possible_direction=fundamental,amount benefits comprehensive cost data employment fnd72_pit_or_is_a_is_oprb_expense_income fundamental fundamental72 income is net other possible_direction post recognized statement that
fundamental72,Comprehensive Fundamental Data,Fundamental,fnd72_pit_or_is_a_is_other_adj_comp_inc,fnd72_pit_or_is_a_is_other_adj_comp_inc,Other Adjustments - Other Comprehensive Income,VECTOR,USA,TOP3000,1,0.8537,,,2026-07-16T15:20:39,possible_direction=fundamental,adjustments comprehensive data fnd72_pit_or_is_a_is_other_adj_comp_inc fundamental fundamental72 income other possible_direction
fundamental72,Comprehensive Fundamental Data,Fundamental,fnd72_pit_or_is_a_is_other_oper_inc,fnd72_pit_or_is_a_is_other_oper_inc,Revenue from all other operating activities which are not related to the principal activities of the company such as royalty and rental income,VECTOR,USA,TOP3000,1,0.3313,,,2026-07-16T15:20:39,possible_direction=fundamental,activities all are as company comprehensive data fnd72_pit_or_is_a_is_other_oper_inc from fundamental fundamental72 income not operating other possible_direction principal related rental revenue royalty such which
fundamental72,Comprehensive Fundamental Data,Fundamental,fnd72_pit_or_is_a_is_over_underfund_pension_exp,fnd72_pit_or_is_a_is_over_underfund_pension_exp,The funded status of the pension plan,VECTOR,USA,TOP3000,1,0.3524,,,2026-07-16T15:20:39,possible_direction=fundamental,comprehensive data fnd72_pit_or_is_a_is_over_underfund_pension_exp fundamental fundamental72 funded pension plan possible_direction status
fundamental72,Comprehensive Fundamental Data,Fundamental,fnd72_pit_or_is_a_is_over_underfunded_post_retirem,fnd72_pit_or_is_a_is_over_underfunded_post_retirem,The funded status of the post-retirement benefit plan,VECTOR,USA,TOP3000,1,0.2542,,,2026-07-16T15:20:39,possible_direction=fundamental,benefit comprehensive data fnd72_pit_or_is_a_is_over_underfunded_post_retirem fundamental fundamental72 funded plan possible_direction post retirement status
fundamental72,Comprehensive Fundamental Data,Fundamental,fnd72_pit_or_is_a_is_pension_expense_income,fnd72_pit_or_is_a_is_pension_expense_income,The net amount of pension cost that is recognized in the income statement,VECTOR,USA,TOP3000,1,0.7019,,,2026-07-16T15:20:39,possible_direction=fundamental,amount comprehensive cost data fnd72_pit_or_is_a_is_pension_expense_income fundamental fundamental72 income is net pension possible_direction recognized statement that
fundamental72,Comprehensive Fundamental Data,Fundamental,fnd72_pit_or_is_a_is_pro_forma_dil_eps_stock_comp,fnd72_pit_or_is_a_is_pro_forma_dil_eps_stock_comp,The pro forma bottom line diluted EPS as if stock-based compensation were recorded in the income statement as an expense,VECTOR,USA,TOP3000,1,0.4918,,,2026-07-16T15:20:39,possible_direction=fundamental,as based bottom compensation comprehensive data diluted eps expense fnd72_pit_or_is_a_is_pro_forma_dil_eps_stock_comp forma fundamental fundamental72 if income line possible_direction pro recorded statement stock were
fundamental72,Comprehensive Fundamental Data,Fundamental,fnd72_pit_or_is_a_is_pro_forma_net_inc_stock_comp,fnd72_pit_or_is_a_is_pro_forma_net_inc_stock_comp,The pro forma net income available for common as if stock compensation were recorded in the income statement as an expense,VECTOR,USA,TOP3000,1,0.3492,,,2026-07-16T15:20:39,possible_direction=fundamental,as available common compensation comprehensive data expense fnd72_pit_or_is_a_is_pro_forma_net_inc_stock_comp forma fundamental fundamental72 if income net possible_direction pro recorded statement stock were
fundamental72,Comprehensive Fundamental Data,Fundamental,fnd72_pit_or_is_a_is_projected_benefit_obligation,fnd72_pit_or_is_a_is_projected_benefit_obligation,Projected Benefit Obligation,VECTOR,USA,TOP3000,1,0.3378,,,2026-07-16T15:20:39,possible_direction=fundamental,benefit comprehensive data fnd72_pit_or_is_a_is_projected_benefit_obligation fundamental fundamental72 obligation possible_direction projected
fundamental72,Comprehensive Fundamental Data,Fundamental,fnd72_pit_or_is_a_is_rate_of_comp_increase_pension,fnd72_pit_or_is_a_is_rate_of_comp_increase_pension,The expected rate of employee compensation growth expressed as a percentage,VECTOR,USA,TOP3000,1,0.279,,,2026-07-16T15:20:39,possible_direction=fundamental,as compensation comprehensive data employee expected expressed fnd72_pit_or_is_a_is_rate_of_comp_increase_pension fundamental fundamental72 growth percentage possible_direction rate
fundamental72,Comprehensive Fundamental Data,Fundamental,fnd72_pit_or_is_a_is_rd_expend,fnd72_pit_or_is_a_is_rd_expend,Total research and development expenditures incurred which includes R&D in profit and loss account and capitalized R&D during the period,VECTOR,USA,TOP3000,1,0.5895,,,2026-07-16T15:20:39,possible_direction=fundamental,account capitalized comprehensive data development during expenditures fnd72_pit_or_is_a_is_rd_expend fundamental fundamental72 includes incurred loss period possible_direction profit research total which
fundamental72,Comprehensive Fundamental Data,Fundamental,fnd72_pit_or_is_a_is_service_cost,fnd72_pit_or_is_a_is_service_cost,The actuarial present value of pension benefits attributed by the pension benefit formula to employee service during a specific period,VECTOR,USA,TOP3000,1,0.338,,,2026-07-16T15:20:39,possible_direction=fundamental,actuarial attributed benefit benefits by comprehensive data during employee fnd72_pit_or_is_a_is_service_cost formula fundamental fundamental72 pension period possible_direction present service specific value
fundamental72,Comprehensive Fundamental Data,Fundamental,fnd72_pit_or_is_a_is_sga_other_op_depr_op_maint,fnd72_pit_or_is_a_is_sga_other_op_depr_op_maint,Includes selling & administrative expenses and other operating expenses after cost of goods sold,VECTOR,USA,TOP3000,1,0.9111,,,2026-07-16T15:20:39,possible_direction=fundamental,administrative after comprehensive cost data expenses fnd72_pit_or_is_a_is_sga_other_op_depr_op_maint fundamental fundamental72 goods includes operating other possible_direction selling sold
fundamental72,Comprehensive Fundamental Data,Fundamental,fnd72_pit_or_is_a_is_sh_for_diluted_eps,fnd72_pit_or_is_a_is_sh_for_diluted_eps,Weighted average number of shares used to calculate Diluted EPS,VECTOR,USA,TOP3000,1,0.9044,,,2026-07-16T15:20:39,possible_direction=fundamental,average calculate comprehensive data diluted eps fnd72_pit_or_is_a_is_sh_for_diluted_eps fundamental fundamental72 number possible_direction shares used weighted
fundamental72,Comprehensive Fundamental Data,Fundamental,fnd72_pit_or_is_a_is_tax_eff_on_abnormal_item,fnd72_pit_or_is_a_is_tax_eff_on_abnormal_item,Tax Effects on Abnormal Items,VECTOR,USA,TOP3000,1,0.7839,,,2026-07-16T15:20:39,possible_direction=fundamental,abnormal comprehensive data effects fnd72_pit_or_is_a_is_tax_eff_on_abnormal_item fundamental fundamental72 items possible_direction tax
fundamental72,Comprehensive Fundamental Data,Fundamental,fnd72_pit_or_is_a_is_tax_eff_on_xo_item,fnd72_pit_or_is_a_is_tax_eff_on_xo_item,Tax Effects on Extraordinary Items,VECTOR,USA,TOP3000,1,0.8438,,,2026-07-16T15:20:39,possible_direction=fundamental,comprehensive data effects extraordinary fnd72_pit_or_is_a_is_tax_eff_on_xo_item fundamental fundamental72 items possible_direction tax
fundamental72,Comprehensive Fundamental Data,Fundamental,fnd72_pit_or_is_a_is_tot_cash_com_dvd,fnd72_pit_or_is_a_is_tot_cash_com_dvd,Dividends paid to common shareholders from the profits of the company,VECTOR,USA,TOP3000,1,0.9052,,,2026-07-16T15:20:39,possible_direction=fundamental,common company comprehensive data dividends fnd72_pit_or_is_a_is_tot_cash_com_dvd from fundamental fundamental72 paid possible_direction profits shareholders
fundamental72,Comprehensive Fundamental Data,Fundamental,fnd72_pit_or_is_a_is_tot_cash_pfd_dvd,fnd72_pit_or_is_a_is_tot_cash_pfd_dvd,Total Cash Preferred Dividends,VECTOR,USA,TOP3000,1,0.9407,,,2026-07-16T15:20:39,possible_direction=fundamental,cash comprehensive data dividends fnd72_pit_or_is_a_is_tot_cash_pfd_dvd fundamental fundamental72 possible_direction preferred total
fundamental72,Comprehensive Fundamental Data,Fundamental,fnd72_pit_or_is_a_is_unrealized_gain_loss_comp_inc,fnd72_pit_or_is_a_is_unrealized_gain_loss_comp_inc,Disclosed as a component in the calculation of Comprehensive Income,VECTOR,USA,TOP3000,1,0.8752,,,2026-07-16T15:20:39,possible_direction=fundamental,as calculation component comprehensive data disclosed fnd72_pit_or_is_a_is_unrealized_gain_loss_comp_inc fundamental fundamental72 income possible_direction
fundamental72,Comprehensive Fundamental Data,Fundamental,fnd72_pit_or_is_a_is_xo_loss_bef_tax_eff,fnd72_pit_or_is_a_is_xo_loss_bef_tax_eff,Extraordinary Loss before Tax Effects,VECTOR,USA,TOP3000,1,0.9055,,,2026-07-16T15:20:39,possible_direction=fundamental,before comprehensive data effects extraordinary fnd72_pit_or_is_a_is_xo_loss_bef_tax_eff fundamental fundamental72 loss possible_direction tax
fundamental72,Comprehensive Fundamental Data,Fundamental,fnd72_pit_or_is_a_latest_period_end_dt_full_record,fnd72_pit_or_is_a_latest_period_end_dt_full_record,This field displays the latest available period end date from full financial records,VECTOR,USA,TOP3000,1,0.9165,,,2026-07-16T15:20:39,possible_direction=fundamental,available comprehensive data date displays end field financial fnd72_pit_or_is_a_latest_period_end_dt_full_record from full fundamental fundamental72 latest period possible_direction records this
fundamental72,Comprehensive Fundamental Data,Fundamental,fnd72_pit_or_is_a_min_noncontrol_interest_credits,fnd72_pit_or_is_a_min_noncontrol_interest_credits,Minority Interests,VECTOR,USA,TOP3000,1,0.9419,,,2026-07-16T15:20:39,possible_direction=fundamental,comprehensive data fnd72_pit_or_is_a_min_noncontrol_interest_credits fundamental fundamental72 interests minority possible_direction
fundamental72,Comprehensive Fundamental Data,Fundamental,fnd72_pit_or_is_a_net_income,fnd72_pit_or_is_a_net_income,Net Income,VECTOR,USA,TOP3000,1,0.9161,,,2026-07-16T15:20:39,possible_direction=fundamental,comprehensive data fnd72_pit_or_is_a_net_income fundamental fundamental72 income net possible_direction
fundamental72,Comprehensive Fundamental Data,Fundamental,fnd72_pit_or_is_a_net_income_bef_mi,fnd72_pit_or_is_a_net_income_bef_mi,Net Income of the company before deducting the portion attributable to minority interest,VECTOR,USA,TOP3000,1,0.9504,,,2026-07-16T15:20:39,possible_direction=fundamental,attributable before company comprehensive data deducting fnd72_pit_or_is_a_net_income_bef_mi fundamental fundamental72 income interest minority net portion possible_direction
fundamental72,Comprehensive Fundamental Data,Fundamental,fnd72_pit_or_is_a_net_non_oper_loss,fnd72_pit_or_is_a_net_non_oper_loss,Net non-operating loss or gain as a percentage of net shares,VECTOR,USA,TOP3000,1,0.8562,,,2026-07-16T15:20:39,possible_direction=fundamental,as comprehensive data fnd72_pit_or_is_a_net_non_oper_loss fundamental fundamental72 gain loss net non operating percentage possible_direction shares
fundamental72,Comprehensive Fundamental Data,Fundamental,fnd72_pit_or_is_a_other_adjustments,fnd72_pit_or_is_a_other_adjustments,Other Adjustments,VECTOR,USA,TOP3000,1,0.8948,,,2026-07-16T15:20:39,possible_direction=fundamental,adjustments comprehensive data fnd72_pit_or_is_a_other_adjustments fundamental fundamental72 other possible_direction
fundamental72,Comprehensive Fundamental Data,Fundamental,fnd72_pit_or_is_a_ox_feb_spe_lid_si,fnd72_pit_or_is_a_ox_feb_spe_lid_si,Diluted EPS Before Extraordinary Items,VECTOR,USA,TOP3000,1,0.9036,,,2026-07-16T15:20:39,possible_direction=fundamental,before comprehensive data diluted eps extraordinary fnd72_pit_or_is_a_ox_feb_spe_lid_si fundamental fundamental72 items possible_direction
fundamental72,Comprehensive Fundamental Data,Fundamental,fnd72_pit_or_is_a_pretax_inc,fnd72_pit_or_is_a_pretax_inc,Gross income before income taxes are withheld,VECTOR,USA,TOP3000,1,0.9071,,,2026-07-16T15:20:39,possible_direction=fundamental,are before comprehensive data fnd72_pit_or_is_a_pretax_inc fundamental fundamental72 gross income possible_direction taxes withheld
fundamental72,Comprehensive Fundamental Data,Fundamental,fnd72_pit_or_is_a_pxe_rped_si,fnd72_pit_or_is_a_pxe_rped_si,Depreciation Expense,VECTOR,USA,TOP3000,1,0.6263,,,2026-07-16T15:20:39,possible_direction=fundamental,comprehensive data depreciation expense fnd72_pit_or_is_a_pxe_rped_si fundamental fundamental72 possible_direction
fundamental72,Comprehensive Fundamental Data,Fundamental,fnd72_pit_or_is_a_sales_rev_turn,fnd72_pit_or_is_a_sales_rev_turn,Sales/Revenue/Turnover,VECTOR,USA,TOP3000,1,0.9086,,,2026-07-16T15:20:39,possible_direction=fundamental,comprehensive data fnd72_pit_or_is_a_sales_rev_turn fundamental fundamental72 possible_direction revenue sales turnover
fundamental72,Comprehensive Fundamental Data,Fundamental,fnd72_pit_or_is_a_spe_si,fnd72_pit_or_is_a_spe_si,Earnings Per Share,VECTOR,USA,TOP3000,1,0.9046,,,2026-07-16T15:20:39,possible_direction=fundamental,comprehensive data earnings fnd72_pit_or_is_a_spe_si fundamental fundamental72 per possible_direction share
fundamental72,Comprehensive Fundamental Data,Fundamental,fnd72_pit_or_is_a_tot_int_exp,fnd72_pit_or_is_a_tot_int_exp,Total interest incurred during the period which includes interest charged to income statement and interest capitalized,VECTOR,USA,TOP3000,1,0.7769,,,2026-07-16T15:20:39,possible_direction=fundamental,capitalized charged comprehensive data during fnd72_pit_or_is_a_tot_int_exp fundamental fundamental72 includes income incurred interest period possible_direction statement total which
fundamental72,Comprehensive Fundamental Data,Fundamental,fnd72_pit_or_is_a_xo_gl_net_of_tax,fnd72_pit_or_is_a_xo_gl_net_of_tax,One-time loss/gain net of tax,VECTOR,USA,TOP3000,1,0.9456,,,2026-07-16T15:20:39,possible_direction=fundamental,comprehensive data fnd72_pit_or_is_a_xo_gl_net_of_tax fundamental fundamental72 gain loss net one possible_direction tax time
fundamental72,Comprehensive Fundamental Data,Fundamental,fnd72_pit_or_is_q_announcement_dt,fnd72_pit_or_is_q_announcement_dt,Indicates the latest earnings announcement date for which full fundamental information is available,VECTOR,USA,TOP3000,1,0.9464,,,2026-07-16T15:20:39,possible_direction=fundamental,announcement available comprehensive data date earnings fnd72_pit_or_is_q_announcement_dt full fundamental fundamental72 indicates information is latest possible_direction which
fundamental72,Comprehensive Fundamental Data,Fundamental,fnd72_pit_or_is_q_cni_tni_si,fnd72_pit_or_is_q_cni_tni_si,Interest Income,VECTOR,USA,TOP3000,1,0.6188,,,2026-07-16T15:20:39,possible_direction=fundamental,comprehensive data fnd72_pit_or_is_q_cni_tni_si fundamental fundamental72 income interest possible_direction
fundamental72,Comprehensive Fundamental Data,Fundamental,fnd72_pit_or_is_q_earn_for_common,fnd72_pit_or_is_q_earn_for_common,Net Income Available To Common Shareholders,VECTOR,USA,TOP3000,1,0.9461,,,2026-07-16T15:20:39,possible_direction=fundamental,available common comprehensive data fnd72_pit_or_is_q_earn_for_common fundamental fundamental72 income net possible_direction shareholders
fundamental72,Comprehensive Fundamental Data,Fundamental,fnd72_pit_or_is_q_ebit,fnd72_pit_or_is_q_ebit,Earnings before interest expenses and income taxes,VECTOR,USA,TOP3000,1,0.8303,,,2026-07-16T15:20:39,possible_direction=fundamental,before comprehensive data earnings expenses fnd72_pit_or_is_q_ebit fundamental fundamental72 income interest possible_direction taxes
fundamental72,Comprehensive Fundamental Data,Fundamental,fnd72_pit_or_is_q_ebitda,fnd72_pit_or_is_q_ebitda,"Indicator of a company's financial performance which is essentially net income with interest, taxes, depreciation, and amortization added back to it, and can be used to analyze and compare profitability between companies and industries because it eliminates the effects of financing and accounting decisions",VECTOR,USA,TOP3000,1,0.8314,,,2026-07-16T15:20:39,possible_direction=fundamental,accounting added amortization analyze back be because between can companies company compare comprehensive data decisions depreciation effects eliminates essentially financial financing fnd72_pit_or_is_q_ebitda fundamental fundamental72 income indicator industries interest is it net performance possible_direction profitability taxes used which
fundamental72,Comprehensive Fundamental Data,Fundamental,fnd72_pit_or_is_q_eff_int_rate,fnd72_pit_or_is_q_eff_int_rate,Percentage of total interest incurred over the average of total debt during the period,VECTOR,USA,TOP3000,1,0.6018,,,2026-07-16T15:20:39,possible_direction=fundamental,average comprehensive data debt during fnd72_pit_or_is_q_eff_int_rate fundamental fundamental72 incurred interest over percentage period possible_direction total
fundamental72,Comprehensive Fundamental Data,Fundamental,fnd72_pit_or_is_q_fundamental_entry_dt,fnd72_pit_or_is_q_fundamental_entry_dt,Date when the fundamental record for this period is created,VECTOR,USA,TOP3000,1,0.9466,,,2026-07-16T15:20:39,possible_direction=fundamental,comprehensive created data date fnd72_pit_or_is_q_fundamental_entry_dt fundamental fundamental72 is period possible_direction record this when
fundamental72,Comprehensive Fundamental Data,Fundamental,fnd72_pit_or_is_q_id_bb_global,fnd72_pit_or_is_q_id_bb_global,"Twelve-character, alphanumeric identifier",VECTOR,USA,TOP3000,1,0.9466,,,2026-07-16T15:20:39,possible_direction=fundamental,alphanumeric character comprehensive data fnd72_pit_or_is_q_id_bb_global fundamental fundamental72 identifier possible_direction twelve
fundamental72,Comprehensive Fundamental Data,Fundamental,fnd72_pit_or_is_q_inc_bef_xo_less_min_int_pref_dvd,fnd72_pit_or_is_q_inc_bef_xo_less_min_int_pref_dvd,"Returns income before extraordinary items and discontinued operation but after minority interest, preferred dividend, and other adjustments",VECTOR,USA,TOP3000,1,0.9451,,,2026-07-16T15:20:39,possible_direction=fundamental,adjustments after before but comprehensive data discontinued dividend extraordinary fnd72_pit_or_is_q_inc_bef_xo_less_min_int_pref_dvd fundamental fundamental72 income interest items minority operation other possible_direction preferred returns
fundamental72,Comprehensive Fundamental Data,Fundamental,fnd72_pit_or_is_q_is_abnormal_item,fnd72_pit_or_is_q_is_abnormal_item,Abnormal Items,VECTOR,USA,TOP3000,1,0.8597,,,2026-07-16T15:20:39,possible_direction=fundamental,abnormal comprehensive data fnd72_pit_or_is_q_is_abnormal_item fundamental fundamental72 items possible_direction
fundamental72,Comprehensive Fundamental Data,Fundamental,fnd72_pit_or_is_q_is_adjusted_eps_as_reported,fnd72_pit_or_is_q_is_adjusted_eps_as_reported,Earnings per share from continuing operations before the effects of one-time gains and losses as disclosed by the company,VECTOR,USA,TOP3000,1,0.3159,,,2026-07-16T15:20:39,possible_direction=fundamental,as before by company comprehensive continuing data disclosed earnings effects fnd72_pit_or_is_q_is_adjusted_eps_as_reported from fundamental fundamental72 gains losses one operations per possible_direction share time
fundamental72,Comprehensive Fundamental Data,Fundamental,fnd72_pit_or_is_q_is_adjusted_net_inc_as_reported,fnd72_pit_or_is_q_is_adjusted_net_inc_as_reported,Net income from continuing operations before the effects of one-time gains and losses as disclosed by the company,VECTOR,USA,TOP3000,1,0.2985,,,2026-07-16T15:20:39,possible_direction=fundamental,as before by company comprehensive continuing data disclosed effects fnd72_pit_or_is_q_is_adjusted_net_inc_as_reported from fundamental fundamental72 gains income losses net one operations possible_direction time
fundamental72,Comprehensive Fundamental Data,Fundamental,fnd72_pit_or_is_q_is_avg_num_sh_for_eps,fnd72_pit_or_is_q_is_avg_num_sh_for_eps,Average number of shares for EPS,VECTOR,USA,TOP3000,1,0.9428,,,2026-07-16T15:20:39,possible_direction=fundamental,average comprehensive data eps fnd72_pit_or_is_q_is_avg_num_sh_for_eps fundamental fundamental72 number possible_direction shares
fundamental72,Comprehensive Fundamental Data,Fundamental,fnd72_pit_or_is_q_is_basic_eps_cont_ops,fnd72_pit_or_is_q_is_basic_eps_cont_ops,Tax Effects on Abnormal Items,VECTOR,USA,TOP3000,1,0.9424,,,2026-07-16T15:20:39,possible_direction=fundamental,abnormal comprehensive data effects fnd72_pit_or_is_q_is_basic_eps_cont_ops fundamental fundamental72 items possible_direction tax
fundamental72,Comprehensive Fundamental Data,Fundamental,fnd72_pit_or_is_q_is_cap_int_exp,fnd72_pit_or_is_q_is_cap_int_exp,"Capitalized interest is the interest added to the cost of a self-constructed, long-term asset",VECTOR,USA,TOP3000,1,0.2927,,,2026-07-16T15:20:39,possible_direction=fundamental,added asset capitalized comprehensive constructed cost data fnd72_pit_or_is_q_is_cap_int_exp fundamental fundamental72 interest is long possible_direction self term
fundamental72,Comprehensive Fundamental Data,Fundamental,fnd72_pit_or_is_q_is_cogs_to_fe_and_pp_and_g,fnd72_pit_or_is_q_is_cogs_to_fe_and_pp_and_g,Cost of Goods Sold/Fuel Expense & Purchased Power & Gas,VECTOR,USA,TOP3000,1,0.7276,,,2026-07-16T15:20:39,possible_direction=fundamental,comprehensive cost data expense fnd72_pit_or_is_q_is_cogs_to_fe_and_pp_and_g fuel fundamental fundamental72 gas goods possible_direction power purchased sold
fundamental72,Comprehensive Fundamental Data,Fundamental,fnd72_pit_or_is_q_is_comprehensive_income,fnd72_pit_or_is_q_is_comprehensive_income,Comprehensive Income,VECTOR,USA,TOP3000,1,0.9328,,,2026-07-16T15:20:39,possible_direction=fundamental,comprehensive data fnd72_pit_or_is_q_is_comprehensive_income fundamental fundamental72 income possible_direction
fundamental72,Comprehensive Fundamental Data,Fundamental,fnd72_pit_or_is_q_is_comprehensive_income_per_shr,fnd72_pit_or_is_q_is_comprehensive_income_per_shr,Comprehensive Income per share,VECTOR,USA,TOP3000,1,0.931,,,2026-07-16T15:20:39,possible_direction=fundamental,comprehensive data fnd72_pit_or_is_q_is_comprehensive_income_per_shr fundamental fundamental72 income per possible_direction share
fundamental72,Comprehensive Fundamental Data,Fundamental,fnd72_pit_or_is_q_is_dil_eps_cont_ops,fnd72_pit_or_is_q_is_dil_eps_cont_ops,Also known as Diluted EPS from Continuing Operations or Adjusted EPS,VECTOR,USA,TOP3000,1,0.9423,,,2026-07-16T15:20:39,possible_direction=fundamental,adjusted also as comprehensive continuing data diluted eps fnd72_pit_or_is_q_is_dil_eps_cont_ops from fundamental fundamental72 known operations possible_direction
fundamental72,Comprehensive Fundamental Data,Fundamental,fnd72_pit_or_is_q_is_diluted_eps,fnd72_pit_or_is_q_is_diluted_eps,Diluted EPS,VECTOR,USA,TOP3000,1,0.9426,,,2026-07-16T15:20:39,possible_direction=fundamental,comprehensive data diluted eps fnd72_pit_or_is_q_is_diluted_eps fundamental fundamental72 possible_direction
fundamental72,Comprehensive Fundamental Data,Fundamental,fnd72_pit_or_is_q_is_div_per_shr,fnd72_pit_or_is_q_is_div_per_shr,Comprehensive Income per share,VECTOR,USA,TOP3000,1,0.935,,,2026-07-16T15:20:39,possible_direction=fundamental,comprehensive data fnd72_pit_or_is_q_is_div_per_shr fundamental fundamental72 income per possible_direction share
fundamental72,Comprehensive Fundamental Data,Fundamental,fnd72_pit_or_is_q_is_earn_bef_xo_items_per_sh,fnd72_pit_or_is_q_is_earn_bef_xo_items_per_sh,Diluted EPS,VECTOR,USA,TOP3000,1,0.9428,,,2026-07-16T15:20:39,possible_direction=fundamental,comprehensive data diluted eps fnd72_pit_or_is_q_is_earn_bef_xo_items_per_sh fundamental fundamental72 possible_direction
fundamental72,Comprehensive Fundamental Data,Fundamental,fnd72_pit_or_is_q_is_expense_stock_based_comp,fnd72_pit_or_is_q_is_expense_stock_based_comp,The expense for stock-based compensation,VECTOR,USA,TOP3000,1,0.6381,,,2026-07-16T15:20:39,possible_direction=fundamental,based compensation comprehensive data expense fnd72_pit_or_is_q_is_expense_stock_based_comp fundamental fundamental72 possible_direction stock
fundamental72,Comprehensive Fundamental Data,Fundamental,fnd72_pit_or_is_q_is_foreign_crncy_trans_adj,fnd72_pit_or_is_q_is_foreign_crncy_trans_adj,Foreign Currency Translation Adjustment,VECTOR,USA,TOP3000,1,0.8803,,,2026-07-16T15:20:39,possible_direction=fundamental,adjustment comprehensive currency data fnd72_pit_or_is_q_is_foreign_crncy_trans_adj foreign fundamental fundamental72 possible_direction translation
fundamental72,Comprehensive Fundamental Data,Fundamental,fnd72_pit_or_is_q_is_foreign_exch_loss,fnd72_pit_or_is_q_is_foreign_exch_loss,Foreign Exchange Losses,VECTOR,USA,TOP3000,1,0.4457,,,2026-07-16T15:20:39,possible_direction=fundamental,comprehensive data exchange fnd72_pit_or_is_q_is_foreign_exch_loss foreign fundamental fundamental72 losses possible_direction
fundamental72,Comprehensive Fundamental Data,Fundamental,fnd72_pit_or_is_q_is_inc_bef_xo_item,fnd72_pit_or_is_q_is_inc_bef_xo_item,Income   before Extraordinary Items,VECTOR,USA,TOP3000,1,0.9459,,,2026-07-16T15:20:39,possible_direction=fundamental,before comprehensive data extraordinary fnd72_pit_or_is_q_is_inc_bef_xo_item fundamental fundamental72 income items possible_direction
