dataset_id,dataset_name,dataset_category,field_id,field_name,description,field_type,region,universe,delay,coverage,user_permission,permission_level,last_seen,notes,keywords
fundamental72,Comprehensive Fundamental Data,Fundamental,fnd72_pit_or_cf_q_latest_period_end_dt_full_record,fnd72_pit_or_cf_q_latest_period_end_dt_full_record,This field displays the latest available period end date from full financial records,VECTOR,USA,TOP3000,1,0.9454,,,2026-07-16T15:20:39,possible_direction=fundamental,available comprehensive data date displays end field financial fnd72_pit_or_cf_q_latest_period_end_dt_full_record from full fundamental fundamental72 latest period possible_direction records this
fundamental72,Comprehensive Fundamental Data,Fundamental,fnd72_pit_or_cr2_a1_announcement_dt,fnd72_pit_or_cr2_a1_announcement_dt,Indicates the latest earnings announcement date for which full fundamental information is available,VECTOR,USA,TOP3000,1,0.8802,,,2026-07-16T15:20:39,possible_direction=fundamental,announcement available comprehensive data date earnings fnd72_pit_or_cr2_a1_announcement_dt full fundamental fundamental72 indicates information is latest possible_direction which
fundamental72,Comprehensive Fundamental Data,Fundamental,fnd72_pit_or_cr2_a1_fundamental_entry_dt,fnd72_pit_or_cr2_a1_fundamental_entry_dt,Date when the fundamental record for this period is created,VECTOR,USA,TOP3000,1,0.8802,,,2026-07-16T15:20:39,possible_direction=fundamental,comprehensive created data date fnd72_pit_or_cr2_a1_fundamental_entry_dt fundamental fundamental72 is period possible_direction record this when
fundamental72,Comprehensive Fundamental Data,Fundamental,fnd72_pit_or_cr2_a1_historical_market_cap,fnd72_pit_or_cr2_a1_historical_market_cap,Total market value of all of a company's outstanding shares at period-end date stated in the company's fundamental currency,VECTOR,USA,TOP3000,1,0.8563,,,2026-07-16T15:20:39,possible_direction=fundamental,all at company comprehensive currency data date end fnd72_pit_or_cr2_a1_historical_market_cap fundamental fundamental72 market outstanding period possible_direction shares stated total value
fundamental72,Comprehensive Fundamental Data,Fundamental,fnd72_pit_or_cr2_a1_invent_to_current_assets,fnd72_pit_or_cr2_a1_invent_to_current_assets,Measures the percentage of Inventories to Current Assets,VECTOR,USA,TOP3000,1,0.543,,,2026-07-16T15:20:39,possible_direction=fundamental,assets comprehensive current data fnd72_pit_or_cr2_a1_invent_to_current_assets fundamental fundamental72 inventories measures percentage possible_direction
fundamental72,Comprehensive Fundamental Data,Fundamental,fnd72_pit_or_cr2_a1_latest_period_end_dt_full_record,fnd72_pit_or_cr2_a1_latest_period_end_dt_full_record,This field displays the latest available period end date from full financial records,VECTOR,USA,TOP3000,1,0.8802,,,2026-07-16T15:20:39,possible_direction=fundamental,available comprehensive data date displays end field financial fnd72_pit_or_cr2_a1_latest_period_end_dt_full_record from full fundamental fundamental72 latest period possible_direction records this
fundamental72,Comprehensive Fundamental Data,Fundamental,fnd72_pit_or_cr2_a2_announcement_dt,fnd72_pit_or_cr2_a2_announcement_dt,Indicates the latest earnings announcement date for which full fundamental information is available,VECTOR,USA,TOP3000,1,0.8802,,,2026-07-16T15:20:39,possible_direction=fundamental,announcement available comprehensive data date earnings fnd72_pit_or_cr2_a2_announcement_dt full fundamental fundamental72 indicates information is latest possible_direction which
fundamental72,Comprehensive Fundamental Data,Fundamental,fnd72_pit_or_cr2_a2_fundamental_entry_dt,fnd72_pit_or_cr2_a2_fundamental_entry_dt,Date when the fundamental record for this period is created,VECTOR,USA,TOP3000,1,0.8802,,,2026-07-16T15:20:39,possible_direction=fundamental,comprehensive created data date fnd72_pit_or_cr2_a2_fundamental_entry_dt fundamental fundamental72 is period possible_direction record this when
fundamental72,Comprehensive Fundamental Data,Fundamental,fnd72_pit_or_cr2_a2_id_bb_global,fnd72_pit_or_cr2_a2_id_bb_global,"Twelve-character, alphanumeric identifier",VECTOR,USA,TOP3000,1,0.8799,,,2026-07-16T15:20:39,possible_direction=fundamental,alphanumeric character comprehensive data fnd72_pit_or_cr2_a2_id_bb_global fundamental fundamental72 identifier possible_direction twelve
fundamental72,Comprehensive Fundamental Data,Fundamental,fnd72_pit_or_cr2_a2_latest_period_end_dt_full_record,fnd72_pit_or_cr2_a2_latest_period_end_dt_full_record,This field displays the latest available period end date from full financial records,VECTOR,USA,TOP3000,1,0.8802,,,2026-07-16T15:20:39,possible_direction=fundamental,available comprehensive data date displays end field financial fnd72_pit_or_cr2_a2_latest_period_end_dt_full_record from full fundamental fundamental72 latest period possible_direction records this
fundamental72,Comprehensive Fundamental Data,Fundamental,fnd72_pit_or_cr2_q1_announcement_dt,fnd72_pit_or_cr2_q1_announcement_dt,Indicates the latest earnings announcement date for which full fundamental information is available,VECTOR,USA,TOP3000,1,0.9124,,,2026-07-16T15:20:39,possible_direction=fundamental,announcement available comprehensive data date earnings fnd72_pit_or_cr2_q1_announcement_dt full fundamental fundamental72 indicates information is latest possible_direction which
fundamental72,Comprehensive Fundamental Data,Fundamental,fnd72_pit_or_cr2_q1_fundamental_entry_dt,fnd72_pit_or_cr2_q1_fundamental_entry_dt,Date when the fundamental record for this period is created,VECTOR,USA,TOP3000,1,0.9124,,,2026-07-16T15:20:39,possible_direction=fundamental,comprehensive created data date fnd72_pit_or_cr2_q1_fundamental_entry_dt fundamental fundamental72 is period possible_direction record this when
fundamental72,Comprehensive Fundamental Data,Fundamental,fnd72_pit_or_cr2_q1_historical_market_cap,fnd72_pit_or_cr2_q1_historical_market_cap,Total market value of all of a company's outstanding shares at period-end date stated in the company's fundamental currency,VECTOR,USA,TOP3000,1,0.9026,,,2026-07-16T15:20:39,possible_direction=fundamental,all at company comprehensive currency data date end fnd72_pit_or_cr2_q1_historical_market_cap fundamental fundamental72 market outstanding period possible_direction shares stated total value
fundamental72,Comprehensive Fundamental Data,Fundamental,fnd72_pit_or_cr2_q1_invent_to_current_assets,fnd72_pit_or_cr2_q1_invent_to_current_assets,Measures the percentage of Inventories to Current Assets,VECTOR,USA,TOP3000,1,0.5566,,,2026-07-16T15:20:39,possible_direction=fundamental,assets comprehensive current data fnd72_pit_or_cr2_q1_invent_to_current_assets fundamental fundamental72 inventories measures percentage possible_direction
fundamental72,Comprehensive Fundamental Data,Fundamental,fnd72_pit_or_cr2_q1_latest_period_end_dt_full_record,fnd72_pit_or_cr2_q1_latest_period_end_dt_full_record,This field displays the latest available period end date from full financial records,VECTOR,USA,TOP3000,1,0.9124,,,2026-07-16T15:20:39,possible_direction=fundamental,available comprehensive data date displays end field financial fnd72_pit_or_cr2_q1_latest_period_end_dt_full_record from full fundamental fundamental72 latest period possible_direction records this
fundamental72,Comprehensive Fundamental Data,Fundamental,fnd72_pit_or_cr2_q2_announcement_dt,fnd72_pit_or_cr2_q2_announcement_dt,Indicates the latest earnings announcement date for which full fundamental information is available,VECTOR,USA,TOP3000,1,0.9468,,,2026-07-16T15:20:39,possible_direction=fundamental,announcement available comprehensive data date earnings fnd72_pit_or_cr2_q2_announcement_dt full fundamental fundamental72 indicates information is latest possible_direction which
fundamental72,Comprehensive Fundamental Data,Fundamental,fnd72_pit_or_cr2_q2_fundamental_entry_dt,fnd72_pit_or_cr2_q2_fundamental_entry_dt,Date when the fundamental record for this period is created,VECTOR,USA,TOP3000,1,0.947,,,2026-07-16T15:20:39,possible_direction=fundamental,comprehensive created data date fnd72_pit_or_cr2_q2_fundamental_entry_dt fundamental fundamental72 is period possible_direction record this when
fundamental72,Comprehensive Fundamental Data,Fundamental,fnd72_pit_or_cr2_q2_id_bb_global,fnd72_pit_or_cr2_q2_id_bb_global,"Twelve-character, alphanumeric identifier",VECTOR,USA,TOP3000,1,0.947,,,2026-07-16T15:20:39,possible_direction=fundamental,alphanumeric character comprehensive data fnd72_pit_or_cr2_q2_id_bb_global fundamental fundamental72 identifier possible_direction twelve
fundamental72,Comprehensive Fundamental Data,Fundamental,fnd72_pit_or_cr2_q2_latest_period_end_dt_full_record,fnd72_pit_or_cr2_q2_latest_period_end_dt_full_record,This field displays the latest available period end date from full financial records,VECTOR,USA,TOP3000,1,0.947,,,2026-07-16T15:20:39,possible_direction=fundamental,available comprehensive data date displays end field financial fnd72_pit_or_cr2_q2_latest_period_end_dt_full_record from full fundamental fundamental72 latest period possible_direction records this
fundamental72,Comprehensive Fundamental Data,Fundamental,fnd72_pit_or_cr_a_5yr_avg_return_on_equity,fnd72_pit_or_cr_a_5yr_avg_return_on_equity,5-year average of return on common equity,VECTOR,USA,TOP3000,1,0.7028,,,2026-07-16T15:20:39,possible_direction=fundamental,average common comprehensive data equity fnd72_pit_or_cr_a_5yr_avg_return_on_equity fundamental fundamental72 possible_direction return year
fundamental72,Comprehensive Fundamental Data,Fundamental,fnd72_pit_or_cr_a_accounts_payable_turnover,fnd72_pit_or_cr_a_accounts_payable_turnover,Company purchases over average accounts payable,VECTOR,USA,TOP3000,1,0.6819,,,2026-07-16T15:20:39,possible_direction=fundamental,accounts average company comprehensive data fnd72_pit_or_cr_a_accounts_payable_turnover fundamental fundamental72 over payable possible_direction purchases
fundamental72,Comprehensive Fundamental Data,Fundamental,fnd72_pit_or_cr_a_accounts_payable_turnover_days,fnd72_pit_or_cr_a_accounts_payable_turnover_days,Number of days in the fiscal period as a multiple of Accounts Payable Turnover,VECTOR,USA,TOP3000,1,0.669,,,2026-07-16T15:20:39,possible_direction=fundamental,accounts as comprehensive data days fiscal fnd72_pit_or_cr_a_accounts_payable_turnover_days fundamental fundamental72 multiple number payable period possible_direction turnover
fundamental72,Comprehensive Fundamental Data,Fundamental,fnd72_pit_or_cr_a_accounts_receivable_growth,fnd72_pit_or_cr_a_accounts_receivable_growth,Percentage growth in inventory from last year to the current year,VECTOR,USA,TOP3000,1,0.6958,,,2026-07-16T15:20:39,possible_direction=fundamental,comprehensive current data fnd72_pit_or_cr_a_accounts_receivable_growth from fundamental fundamental72 growth inventory last percentage possible_direction year
fundamental72,Comprehensive Fundamental Data,Fundamental,fnd72_pit_or_cr_a_acct_rcv_days,fnd72_pit_or_cr_a_acct_rcv_days,Measure of the average number of days that a company takes to collect revenue after a sale has been made,VECTOR,USA,TOP3000,1,0.7012,,,2026-07-16T15:20:39,possible_direction=fundamental,after average been collect company comprehensive data days fnd72_pit_or_cr_a_acct_rcv_days fundamental fundamental72 has made measure number possible_direction revenue sale takes that
fundamental72,Comprehensive Fundamental Data,Fundamental,fnd72_pit_or_cr_a_acct_rcv_to_tot_asset,fnd72_pit_or_cr_a_acct_rcv_to_tot_asset,Ratio to measure the percentage of account & notes receivables over total assets,VECTOR,USA,TOP3000,1,0.8469,,,2026-07-16T15:20:39,possible_direction=fundamental,account assets comprehensive data fnd72_pit_or_cr_a_acct_rcv_to_tot_asset fundamental fundamental72 measure notes over percentage possible_direction ratio receivables total
fundamental72,Comprehensive Fundamental Data,Fundamental,fnd72_pit_or_cr_a_acct_rcv_turn,fnd72_pit_or_cr_a_acct_rcv_turn,Ratio that measures how many times a business can collect its average accounts receivable during the year,VECTOR,USA,TOP3000,1,0.7026,,,2026-07-16T15:20:39,possible_direction=fundamental,accounts average business can collect comprehensive data during fnd72_pit_or_cr_a_acct_rcv_turn fundamental fundamental72 how its many measures possible_direction ratio receivable that times year
fundamental72,Comprehensive Fundamental Data,Fundamental,fnd72_pit_or_cr_a_actual_sales_per_empl,fnd72_pit_or_cr_a_actual_sales_per_empl,Measure to indicate how much revenue allocates to an employee for the period,VECTOR,USA,TOP3000,1,0.8121,,,2026-07-16T15:20:39,possible_direction=fundamental,allocates comprehensive data employee fnd72_pit_or_cr_a_actual_sales_per_empl fundamental fundamental72 how indicate measure much period possible_direction revenue
fundamental72,Comprehensive Fundamental Data,Fundamental,fnd72_pit_or_cr_a_ann_return_com_eqy,fnd72_pit_or_cr_a_ann_return_com_eqy,"Measure, in percentage, which assesses a company's profit in relation to the money invested by shareholders",VECTOR,USA,TOP3000,1,0.8568,,,2026-07-16T15:20:39,possible_direction=fundamental,assesses by company comprehensive data fnd72_pit_or_cr_a_ann_return_com_eqy fundamental fundamental72 invested measure money percentage possible_direction profit relation shareholders which
fundamental72,Comprehensive Fundamental Data,Fundamental,fnd72_pit_or_cr_a_announcement_dt,fnd72_pit_or_cr_a_announcement_dt,Indicates the latest earnings announcement date for which full fundamental information is available,VECTOR,USA,TOP3000,1,0.9151,,,2026-07-16T15:20:39,possible_direction=fundamental,announcement available comprehensive data date earnings fnd72_pit_or_cr_a_announcement_dt full fundamental fundamental72 indicates information is latest possible_direction which
fundamental72,Comprehensive Fundamental Data,Fundamental,fnd72_pit_or_cr_a_asset_growth,fnd72_pit_or_cr_a_asset_growth,A percentage increase or decrease of total assets by comparing current period with same period prior year,VECTOR,USA,TOP3000,1,0.8988,,,2026-07-16T15:20:39,possible_direction=fundamental,assets by comparing comprehensive current data decrease fnd72_pit_or_cr_a_asset_growth fundamental fundamental72 increase percentage period possible_direction prior same total year
fundamental72,Comprehensive Fundamental Data,Fundamental,fnd72_pit_or_cr_a_asset_per_empl,fnd72_pit_or_cr_a_asset_per_empl,"Measure of total assets per 1,000 employees",VECTOR,USA,TOP3000,1,0.7714,,,2026-07-16T15:20:39,possible_direction=fundamental,000 assets comprehensive data employees fnd72_pit_or_cr_a_asset_per_empl fundamental fundamental72 measure per possible_direction total
fundamental72,Comprehensive Fundamental Data,Fundamental,fnd72_pit_or_cr_a_asset_to_eqy,fnd72_pit_or_cr_a_asset_to_eqy,Total assets divided by shareholders' equity,VECTOR,USA,TOP3000,1,0.9129,,,2026-07-16T15:20:39,possible_direction=fundamental,assets by comprehensive data divided equity fnd72_pit_or_cr_a_asset_to_eqy fundamental fundamental72 possible_direction shareholders total
fundamental72,Comprehensive Fundamental Data,Fundamental,fnd72_pit_or_cr_a_asset_turnover,fnd72_pit_or_cr_a_asset_turnover,Amount of sales or revenues generated per dollar of assets,VECTOR,USA,TOP3000,1,0.8982,,,2026-07-16T15:20:39,possible_direction=fundamental,amount assets comprehensive data dollar fnd72_pit_or_cr_a_asset_turnover fundamental fundamental72 generated per possible_direction revenues sales
fundamental72,Comprehensive Fundamental Data,Fundamental,fnd72_pit_or_cr_a_avg_com_eqy_to_avg_asset,fnd72_pit_or_cr_a_avg_com_eqy_to_avg_asset,Measures the percentage of average common equity to average assets,VECTOR,USA,TOP3000,1,0.3666,,,2026-07-16T15:20:39,possible_direction=fundamental,assets average common comprehensive data equity fnd72_pit_or_cr_a_avg_com_eqy_to_avg_asset fundamental fundamental72 measures percentage possible_direction
fundamental72,Comprehensive Fundamental Data,Fundamental,fnd72_pit_or_cr_a_book_val_per_sh,fnd72_pit_or_cr_a_book_val_per_sh,Measure used by owners of common shares in a firm to determine the level of safety associated with each individual share after all debts are paid accordingly,VECTOR,USA,TOP3000,1,0.9042,,,2026-07-16T15:20:39,possible_direction=fundamental,accordingly after all are associated by common comprehensive data debts determine each firm fnd72_pit_or_cr_a_book_val_per_sh fundamental fundamental72 individual level measure owners paid possible_direction safety share shares used
fundamental72,Comprehensive Fundamental Data,Fundamental,fnd72_pit_or_cr_a_bvps_growth,fnd72_pit_or_cr_a_bvps_growth,Percentage increase or decrease of book value per share by comparing current period with same period prior year,VECTOR,USA,TOP3000,1,0.8705,,,2026-07-16T15:20:39,possible_direction=fundamental,book by comparing comprehensive current data decrease fnd72_pit_or_cr_a_bvps_growth fundamental fundamental72 increase per percentage period possible_direction prior same share value year
fundamental72,Comprehensive Fundamental Data,Fundamental,fnd72_pit_or_cr_a_cash_conversion_cycle,fnd72_pit_or_cr_a_cash_conversion_cycle,"Metric which expresses the length of time, in days, that it takes for a company to convert resource inputs into cash flows",VECTOR,USA,TOP3000,1,0.5332,,,2026-07-16T15:20:39,possible_direction=fundamental,cash company comprehensive convert data days expresses flows fnd72_pit_or_cr_a_cash_conversion_cycle fundamental fundamental72 inputs into it length metric possible_direction resource takes that time which
fundamental72,Comprehensive Fundamental Data,Fundamental,fnd72_pit_or_cr_a_cash_flow_growth,fnd72_pit_or_cr_a_cash_flow_growth,Cash Flow Growth is calculated using the following formula,VECTOR,USA,TOP3000,1,0.865,,,2026-07-16T15:20:39,possible_direction=fundamental,calculated cash comprehensive data flow fnd72_pit_or_cr_a_cash_flow_growth following formula fundamental fundamental72 growth is possible_direction using
fundamental72,Comprehensive Fundamental Data,Fundamental,fnd72_pit_or_cr_a_cash_flow_grwth_to_net_inc_grwth,fnd72_pit_or_cr_a_cash_flow_grwth_to_net_inc_grwth,Ratio used to compare Cash Flow Growth to Net Income Growth,VECTOR,USA,TOP3000,1,0.8142,,,2026-07-16T15:20:39,possible_direction=fundamental,cash compare comprehensive data flow fnd72_pit_or_cr_a_cash_flow_grwth_to_net_inc_grwth fundamental fundamental72 growth income net possible_direction ratio used
fundamental72,Comprehensive Fundamental Data,Fundamental,fnd72_pit_or_cr_a_cash_flow_per_sh,fnd72_pit_or_cr_a_cash_flow_per_sh,"Measure of a firm's financial strength which represents the net cash a firm produces, on a per share basis",VECTOR,USA,TOP3000,1,0.9033,,,2026-07-16T15:20:39,possible_direction=fundamental,basis cash comprehensive data financial firm fnd72_pit_or_cr_a_cash_flow_per_sh fundamental fundamental72 measure net per possible_direction produces represents share strength which
fundamental72,Comprehensive Fundamental Data,Fundamental,fnd72_pit_or_cr_a_cash_flow_per_shr_growth,fnd72_pit_or_cr_a_cash_flow_per_shr_growth,The percentage change in Cash Flow per Basic Share from last year to the current year,VECTOR,USA,TOP3000,1,0.8513,,,2026-07-16T15:20:39,possible_direction=fundamental,basic cash change comprehensive current data flow fnd72_pit_or_cr_a_cash_flow_per_shr_growth from fundamental fundamental72 last per percentage possible_direction share year
fundamental72,Comprehensive Fundamental Data,Fundamental,fnd72_pit_or_cr_a_cash_flow_to_int_expense,fnd72_pit_or_cr_a_cash_flow_to_int_expense,Measures the ratio of cash flow from operations to total interest incurred during the period,VECTOR,USA,TOP3000,1,0.6794,,,2026-07-16T15:20:39,possible_direction=fundamental,cash comprehensive data during flow fnd72_pit_or_cr_a_cash_flow_to_int_expense from fundamental fundamental72 incurred interest measures operations period possible_direction ratio total
fundamental72,Comprehensive Fundamental Data,Fundamental,fnd72_pit_or_cr_a_cash_flow_to_tot_liab,fnd72_pit_or_cr_a_cash_flow_to_tot_liab,Cash flow to total liabilities,VECTOR,USA,TOP3000,1,0.9116,,,2026-07-16T15:20:39,possible_direction=fundamental,cash comprehensive data flow fnd72_pit_or_cr_a_cash_flow_to_tot_liab fundamental fundamental72 liabilities possible_direction total
fundamental72,Comprehensive Fundamental Data,Fundamental,fnd72_pit_or_cr_a_cash_gen_to_cash_req,fnd72_pit_or_cr_a_cash_gen_to_cash_req,Ratio to measure cash generated from operations over cash paid for the operation during the period,VECTOR,USA,TOP3000,1,0.7432,,,2026-07-16T15:20:39,possible_direction=fundamental,cash comprehensive data during fnd72_pit_or_cr_a_cash_gen_to_cash_req from fundamental fundamental72 generated measure operation operations over paid period possible_direction ratio
fundamental72,Comprehensive Fundamental Data,Fundamental,fnd72_pit_or_cr_a_cash_ratio,fnd72_pit_or_cr_a_cash_ratio,Ratio which indicates a company's liquidity,VECTOR,USA,TOP3000,1,0.7452,,,2026-07-16T15:20:39,possible_direction=fundamental,company comprehensive data fnd72_pit_or_cr_a_cash_ratio fundamental fundamental72 indicates liquidity possible_direction ratio which
fundamental72,Comprehensive Fundamental Data,Fundamental,fnd72_pit_or_cr_a_cash_st_investments_per_sh,fnd72_pit_or_cr_a_cash_st_investments_per_sh,This is the cash and marketable securities per share,VECTOR,USA,TOP3000,1,0.9042,,,2026-07-16T15:20:39,possible_direction=fundamental,cash comprehensive data fnd72_pit_or_cr_a_cash_st_investments_per_sh fundamental fundamental72 is marketable per possible_direction securities share this
fundamental72,Comprehensive Fundamental Data,Fundamental,fnd72_pit_or_cr_a_cash_st_investments_to_cur_asset,fnd72_pit_or_cr_a_cash_st_investments_to_cur_asset,Cash and short-term investments as a percentage of current assets,VECTOR,USA,TOP3000,1,0.7451,,,2026-07-16T15:20:39,possible_direction=fundamental,as assets cash comprehensive current data fnd72_pit_or_cr_a_cash_st_investments_to_cur_asset fundamental fundamental72 investments percentage possible_direction short term
fundamental72,Comprehensive Fundamental Data,Fundamental,fnd72_pit_or_cr_a_cash_to_tot_asset,fnd72_pit_or_cr_a_cash_to_tot_asset,Ratio to measure the percentage of cash and near cash over total assets,VECTOR,USA,TOP3000,1,0.913,,,2026-07-16T15:20:39,possible_direction=fundamental,assets cash comprehensive data fnd72_pit_or_cr_a_cash_to_tot_asset fundamental fundamental72 measure near over percentage possible_direction ratio total
fundamental72,Comprehensive Fundamental Data,Fundamental,fnd72_pit_or_cr_a_cfo_to_tot_debt,fnd72_pit_or_cr_a_cfo_to_tot_debt,Total debt as a multiple of cash flow from operations,VECTOR,USA,TOP3000,1,0.7792,,,2026-07-16T15:20:39,possible_direction=fundamental,as cash comprehensive data debt flow fnd72_pit_or_cr_a_cfo_to_tot_debt from fundamental fundamental72 multiple operations possible_direction total
fundamental72,Comprehensive Fundamental Data,Fundamental,fnd72_pit_or_cr_a_com_eqy_to_tot_asset,fnd72_pit_or_cr_a_com_eqy_to_tot_asset,One of many financial ratios used to determine the financial health and long-term profitability of a corporation,VECTOR,USA,TOP3000,1,0.913,,,2026-07-16T15:20:39,possible_direction=fundamental,comprehensive corporation data determine financial fnd72_pit_or_cr_a_com_eqy_to_tot_asset fundamental fundamental72 health long many one possible_direction profitability ratios term used
fundamental72,Comprehensive Fundamental Data,Fundamental,fnd72_pit_or_cr_a_cont_inc_per_sh,fnd72_pit_or_cr_a_cont_inc_per_sh,Measure of a firm's profitability that uses profits before continuing operations,VECTOR,USA,TOP3000,1,0.9038,,,2026-07-16T15:20:39,possible_direction=fundamental,before comprehensive continuing data firm fnd72_pit_or_cr_a_cont_inc_per_sh fundamental fundamental72 measure operations possible_direction profitability profits that uses
fundamental72,Comprehensive Fundamental Data,Fundamental,fnd72_pit_or_cr_a_cur_ratio,fnd72_pit_or_cr_a_cur_ratio,Ratio to indicate the company's ability to pay back its short-term liabilities with its short-term assets,VECTOR,USA,TOP3000,1,0.7453,,,2026-07-16T15:20:39,possible_direction=fundamental,ability assets back company comprehensive data fnd72_pit_or_cr_a_cur_ratio fundamental fundamental72 indicate its liabilities pay possible_direction ratio short term
fundamental72,Comprehensive Fundamental Data,Fundamental,fnd72_pit_or_cr_a_debt_to_mkt_cap,fnd72_pit_or_cr_a_debt_to_mkt_cap,Ratio used to measure a company's debt against its market size,VECTOR,USA,TOP3000,1,0.8908,,,2026-07-16T15:20:39,possible_direction=fundamental,against company comprehensive data debt fnd72_pit_or_cr_a_debt_to_mkt_cap fundamental fundamental72 its market measure possible_direction ratio size used
fundamental72,Comprehensive Fundamental Data,Fundamental,fnd72_pit_or_cr_a_degree_financial_leverage,fnd72_pit_or_cr_a_degree_financial_leverage,Leverage ratio summarizing the effect a particular amount of financial leverage has on a company's earnings,VECTOR,USA,TOP3000,1,0.5633,,,2026-07-16T15:20:39,possible_direction=fundamental,amount company comprehensive data earnings effect financial fnd72_pit_or_cr_a_degree_financial_leverage fundamental fundamental72 has leverage particular possible_direction ratio summarizing
fundamental72,Comprehensive Fundamental Data,Fundamental,fnd72_pit_or_cr_a_diluted_eps_cont_ops_5yr_avg_gr,fnd72_pit_or_cr_a_diluted_eps_cont_ops_5yr_avg_gr,Diluted earnings per share from continuing operations five-year arithmetic average growth,VECTOR,USA,TOP3000,1,0.5715,,,2026-07-16T15:20:39,possible_direction=fundamental,arithmetic average comprehensive continuing data diluted earnings five fnd72_pit_or_cr_a_diluted_eps_cont_ops_5yr_avg_gr from fundamental fundamental72 growth operations per possible_direction share year
