dataset_id,dataset_name,dataset_category,field_id,field_name,description,field_type,region,universe,delay,coverage,user_permission,permission_level,last_seen,notes,keywords
model10,Research Indicators,Model,mdl10_1330_chop,mdl10_1330_chop,"14-day Choppiness Index (0–100), quantifies how sideways (choppy) vs. trending price movement is",MATRIX,USA,TOP3000,1,0.997,,,2026-07-16T15:20:39,possible_direction=unknown,100 14 choppiness choppy day how index indicators is mdl10_1330_chop model model10 movement possible_direction price quantifies research sideways trending unknown vs
model10,Research Indicators,Model,mdl10_1330_close,mdl10_1330_close,Closing price of the stock for the trading day,MATRIX,USA,TOP3000,1,0.9977,,,2026-07-16T15:20:39,possible_direction=unknown,closing day indicators mdl10_1330_close model model10 possible_direction price research stock trading unknown
model10,Research Indicators,Model,mdl10_1330_erlanger_option_rank,mdl10_1330_erlanger_option_rank,"A proprietary rank indicating overbought or oversold conditions based on options activity, including volume, price, open interest, and money flow in options",MATRIX,USA,TOP3000,1,0.9453,,,2026-07-16T15:20:39,possible_direction=volume,activity based conditions flow including indicating indicators interest mdl10_1330_erlanger_option_rank model model10 money open options overbought oversold possible_direction price proprietary rank research volume
model10,Research Indicators,Model,mdl10_1330_float,mdl10_1330_float,Number of shares outstanding and available for public trading,MATRIX,USA,TOP3000,1,0.9925,,,2026-07-16T15:20:39,possible_direction=unknown,available indicators mdl10_1330_float model model10 number outstanding possible_direction public research shares trading unknown
model10,Research Indicators,Model,mdl10_1330_future_juice_10_days,mdl10_1330_future_juice_10_days,"Seasonal cycle value change predicted for the next 10 trading days; positive means historically stronger, negative means weaker",MATRIX,USA,TOP3000,1,0.9243,,,2026-07-16T15:20:39,possible_direction=unknown,10 change cycle days historically indicators mdl10_1330_future_juice_10_days means model model10 negative next positive possible_direction predicted research seasonal stronger trading unknown value weaker
model10,Research Indicators,Model,mdl10_1330_future_juice_20_days,mdl10_1330_future_juice_20_days,Change in the stock's seasonal cycle value from today to 20 trading days ahead; measures expected upward or downward seasonal movement over the next 20 days,MATRIX,USA,TOP3000,1,0.9243,,,2026-07-16T15:20:39,possible_direction=unknown,20 ahead change cycle days downward expected from indicators mdl10_1330_future_juice_20_days measures model model10 movement next over possible_direction research seasonal stock today trading unknown upward value
model10,Research Indicators,Model,mdl10_1330_future_juice_40_days,mdl10_1330_future_juice_40_days,Change in the stock's seasonal cycle value from today to 40 trading days ahead; measures expected upward or downward seasonal movement over the next 40 days,MATRIX,USA,TOP3000,1,0.9243,,,2026-07-16T15:20:39,possible_direction=unknown,40 ahead change cycle days downward expected from indicators mdl10_1330_future_juice_40_days measures model model10 movement next over possible_direction research seasonal stock today trading unknown upward value
model10,Research Indicators,Model,mdl10_1330_group_avg_power_rank,mdl10_1330_group_avg_power_rank,Average Power Rank (composite technical + short ranks) for all stocks in the same group,MATRIX,USA,TOP3000,1,0.9955,,,2026-07-16T15:20:39,possible_direction=unknown,all average composite group indicators mdl10_1330_group_avg_power_rank model model10 possible_direction power rank ranks research same short stocks technical unknown
model10,Research Indicators,Model,mdl10_1330_group_avg_short_rank,mdl10_1330_group_avg_short_rank,Average Short Rank score across all stocks in the same industry group,MATRIX,USA,TOP3000,1,0.9955,,,2026-07-16T15:20:39,possible_direction=unknown,across all average group indicators industry mdl10_1330_group_avg_short_rank model model10 possible_direction rank research same score short stocks unknown
model10,Research Indicators,Model,mdl10_1330_group_avg_tech_rank,mdl10_1330_group_avg_tech_rank,The average technical strength rank (Erlanger Technical Rank) of all issues in the defined stock group,MATRIX,USA,TOP3000,1,0.9955,,,2026-07-16T15:20:39,possible_direction=unknown,all average defined erlanger group indicators issues mdl10_1330_group_avg_tech_rank model model10 possible_direction rank research stock strength technical unknown
model10,Research Indicators,Model,mdl10_1330_group_issue_count,mdl10_1330_group_issue_count,Number of stock issues in the same group as the current stock,MATRIX,USA,TOP3000,1,0.9955,,,2026-07-16T15:20:39,possible_direction=unknown,as current group indicators issues mdl10_1330_group_issue_count model model10 number possible_direction research same stock unknown
model10,Research Indicators,Model,mdl10_1330_group_issues_above_200_day_avg,mdl10_1330_group_issues_above_200_day_avg,Number of issues in the group with a closing price above their 200-day moving average,MATRIX,USA,TOP3000,1,0.9955,,,2026-07-16T15:20:39,possible_direction=unknown,200 above average closing day group indicators issues mdl10_1330_group_issues_above_200_day_avg model model10 moving number possible_direction price research their unknown
model10,Research Indicators,Model,mdl10_1330_group_issues_above_50_day_avg,mdl10_1330_group_issues_above_50_day_avg,Number of stocks in the group with closing price above their 50-day moving average,MATRIX,USA,TOP3000,1,0.9955,,,2026-07-16T15:20:39,possible_direction=unknown,50 above average closing day group indicators mdl10_1330_group_issues_above_50_day_avg model model10 moving number possible_direction price research stocks their unknown
model10,Research Indicators,Model,mdl10_1330_group_long_squeeze_potential,mdl10_1330_group_long_squeeze_potential,"Sum of the percentages of issues in the group that are classified as Type 2 (Recognized Strength) and Type 4 (Long Squeeze), indicating group-level potential for a long squeeze scenario",MATRIX,USA,TOP3000,1,0.9955,,,2026-07-16T15:20:39,possible_direction=unknown,are as classified group indicating indicators issues level long mdl10_1330_group_long_squeeze_potential model model10 percentages possible_direction potential recognized research scenario squeeze strength sum that type unknown
model10,Research Indicators,Model,mdl10_1330_group_rank,mdl10_1330_group_rank,"Relative ranking (1 = strongest, 139 = weakest) of the stock's industry group based on technical and sentiment criteria",MATRIX,USA,TOP3000,1,0.9955,,,2026-07-16T15:20:39,possible_direction=sentiment,139 based criteria group indicators industry mdl10_1330_group_rank model model10 possible_direction ranking relative research sentiment stock strongest technical weakest
model10,Research Indicators,Model,mdl10_1330_group_short_squeeze_potential,mdl10_1330_group_short_squeeze_potential,"Sum of percentage of issues in the group classified as 'Type 1' and 'Type 3', measuring potential for short squeezes in the group",MATRIX,USA,TOP3000,1,0.9955,,,2026-07-16T15:20:39,possible_direction=unknown,as classified group indicators issues mdl10_1330_group_short_squeeze_potential measuring model model10 percentage possible_direction potential research short squeezes sum type unknown
model10,Research Indicators,Model,mdl10_1330_group_type_1,mdl10_1330_group_type_1,Percentage of issues in group currently classified as Type 1 (Short Squeeze),MATRIX,USA,TOP3000,1,0.9955,,,2026-07-16T15:20:39,possible_direction=unknown,as classified currently group indicators issues mdl10_1330_group_type_1 model model10 percentage possible_direction research short squeeze type unknown
model10,Research Indicators,Model,mdl10_1330_group_type_2,mdl10_1330_group_type_2,"Percentage of stocks in the Erlanger Group currently classified as 'Type 2', which means strong technical with low short interest (hold signal)",MATRIX,USA,TOP3000,1,0.9955,,,2026-07-16T15:20:39,possible_direction=unknown,as classified currently erlanger group hold indicators interest low mdl10_1330_group_type_2 means model model10 percentage possible_direction research short signal stocks strong technical type unknown which
model10,Research Indicators,Model,mdl10_1330_group_type_3,mdl10_1330_group_type_3,"Percentage of stocks in the group classified as Type 3 (“Shorts Are Right”, i.e., high short interest, weak technicals)",MATRIX,USA,TOP3000,1,0.9955,,,2026-07-16T15:20:39,possible_direction=unknown,are as classified group high indicators interest mdl10_1330_group_type_3 model model10 percentage possible_direction research right short shorts stocks technicals type unknown weak
model10,Research Indicators,Model,mdl10_1330_group_type_4,mdl10_1330_group_type_4,Percentage of issues in the group currently classified as Type 4 (Long Squeeze),MATRIX,USA,TOP3000,1,0.9955,,,2026-07-16T15:20:39,possible_direction=unknown,as classified currently group indicators issues long mdl10_1330_group_type_4 model model10 percentage possible_direction research squeeze type unknown
model10,Research Indicators,Model,mdl10_1330_high,mdl10_1330_high,Daily high price for the trading date,MATRIX,USA,TOP3000,1,0.9977,,,2026-07-16T15:20:39,possible_direction=unknown,daily date high indicators mdl10_1330_high model model10 possible_direction price research trading unknown
model10,Research Indicators,Model,mdl10_1330_inst_ownership,mdl10_1330_inst_ownership,Percentage of the stock's outstanding shares owned by institutional investors,MATRIX,USA,TOP3000,1,0.9529,,,2026-07-16T15:20:39,possible_direction=unknown,by indicators institutional investors mdl10_1330_inst_ownership model model10 outstanding owned percentage possible_direction research shares stock unknown
model10,Research Indicators,Model,mdl10_1330_long_heat,mdl10_1330_long_heat,Percent of time strong seasonal zones overlapped in prior years for current date,MATRIX,USA,TOP3000,1,0.9243,,,2026-07-16T15:20:39,possible_direction=unknown,current date indicators mdl10_1330_long_heat model model10 overlapped percent possible_direction prior research seasonal strong time unknown years zones
model10,Research Indicators,Model,mdl10_1330_long_zone_days,mdl10_1330_long_zone_days,"Number of days remaining in the current 'long zone' for the security, denoting the time left in a seasonally strong period",MATRIX,USA,TOP3000,1,0.9243,,,2026-07-16T15:20:39,possible_direction=unknown,current days denoting indicators left long mdl10_1330_long_zone_days model model10 number period possible_direction remaining research seasonally security strong time unknown zone
model10,Research Indicators,Model,mdl10_1330_long_zone_juice,mdl10_1330_long_zone_juice,"Difference in seasonal cycle value for a stock from the end of the current long zone to today, indicating momentum within the long zone",MATRIX,USA,TOP3000,1,0.9243,,,2026-07-16T15:20:39,possible_direction=unknown,current cycle difference end from indicating indicators long mdl10_1330_long_zone_juice model model10 momentum possible_direction research seasonal stock today unknown value within zone
model10,Research Indicators,Model,mdl10_1330_long_zone_rank,mdl10_1330_long_zone_rank,Seasonal Long Zone Rank: calculated as the ratio of the Seasonal Long Zone Juice to Long Zone Days remaining; gauges strength of the current long seasonal window,MATRIX,USA,TOP3000,1,0.9243,,,2026-07-16T15:20:39,possible_direction=unknown,as calculated current days gauges indicators juice long mdl10_1330_long_zone_rank model model10 possible_direction rank ratio remaining research seasonal strength unknown window zone
model10,Research Indicators,Model,mdl10_1330_low,mdl10_1330_low,Lowest price for the stock during the trading day,MATRIX,USA,TOP3000,1,0.9977,,,2026-07-16T15:20:39,possible_direction=unknown,day during indicators lowest mdl10_1330_low model model10 possible_direction price research stock trading unknown
model10,Research Indicators,Model,mdl10_1330_market_cap,mdl10_1330_market_cap,"Market capitalization value of the company, calculated from share price and shares outstanding",MATRIX,USA,TOP3000,1,0.9958,,,2026-07-16T15:20:39,possible_direction=unknown,calculated capitalization company from indicators market mdl10_1330_market_cap model model10 outstanding possible_direction price research share shares unknown value
model10,Research Indicators,Model,mdl10_1330_market_cap_l,mdl10_1330_market_cap_l,"Market capitalization, expressed in logarithmic scale",MATRIX,USA,TOP3000,1,0.9958,,,2026-07-16T15:20:39,possible_direction=unknown,capitalization expressed indicators logarithmic market mdl10_1330_market_cap_l model model10 possible_direction research scale unknown
model10,Research Indicators,Model,mdl10_1330_open,mdl10_1330_open,The stock's opening price for the trading day,MATRIX,USA,TOP3000,1,0.9977,,,2026-07-16T15:20:39,possible_direction=unknown,day indicators mdl10_1330_open model model10 opening possible_direction price research stock trading unknown
model10,Research Indicators,Model,mdl10_1330_power_rank,mdl10_1330_power_rank,"Composite overall ranking (1–100) combining Technical Rank and Short Rank, emphasizing technicals",MATRIX,USA,TOP3000,1,0.9759,,,2026-07-16T15:20:39,possible_direction=unknown,100 combining composite emphasizing indicators mdl10_1330_power_rank model model10 overall possible_direction rank ranking research short technical technicals unknown
model10,Research Indicators,Model,mdl10_1330_price_10_day_mva,mdl10_1330_price_10_day_mva,Simple moving average of the closing price over the past 10 trading days,MATRIX,USA,TOP3000,1,0.9971,,,2026-07-16T15:20:39,possible_direction=unknown,10 average closing days indicators mdl10_1330_price_10_day_mva model model10 moving over past possible_direction price research simple trading unknown
model10,Research Indicators,Model,mdl10_1330_price_15_day_mva,mdl10_1330_price_15_day_mva,The 15-day simple moving average of the stock's closing price,MATRIX,USA,TOP3000,1,0.9971,,,2026-07-16T15:20:39,possible_direction=unknown,15 average closing day indicators mdl10_1330_price_15_day_mva model model10 moving possible_direction price research simple stock unknown
model10,Research Indicators,Model,mdl10_1330_price_200_day_mva,mdl10_1330_price_200_day_mva,Simple moving average of closing price over the last 200 trading days,MATRIX,USA,TOP3000,1,0.9971,,,2026-07-16T15:20:39,possible_direction=unknown,200 average closing days indicators last mdl10_1330_price_200_day_mva model model10 moving over possible_direction price research simple trading unknown
model10,Research Indicators,Model,mdl10_1330_price_20_day_mva,mdl10_1330_price_20_day_mva,20-day simple moving average of the stock's closing price,MATRIX,USA,TOP3000,1,0.9971,,,2026-07-16T15:20:39,possible_direction=unknown,20 average closing day indicators mdl10_1330_price_20_day_mva model model10 moving possible_direction price research simple stock unknown
model10,Research Indicators,Model,mdl10_1330_price_25_day_mva,mdl10_1330_price_25_day_mva,Simple moving average of closing price over the last 25 trading days,MATRIX,USA,TOP3000,1,0.9971,,,2026-07-16T15:20:39,possible_direction=unknown,25 average closing days indicators last mdl10_1330_price_25_day_mva model model10 moving over possible_direction price research simple trading unknown
model10,Research Indicators,Model,mdl10_1330_price_30_day_mva,mdl10_1330_price_30_day_mva,Simple moving average of closing price over the last 30 trading days,MATRIX,USA,TOP3000,1,0.9971,,,2026-07-16T15:20:39,possible_direction=unknown,30 average closing days indicators last mdl10_1330_price_30_day_mva model model10 moving over possible_direction price research simple trading unknown
model10,Research Indicators,Model,mdl10_1330_price_35_day_mva,mdl10_1330_price_35_day_mva,Simple moving average of closing price over the last 35 trading days,MATRIX,USA,TOP3000,1,0.9971,,,2026-07-16T15:20:39,possible_direction=unknown,35 average closing days indicators last mdl10_1330_price_35_day_mva model model10 moving over possible_direction price research simple trading unknown
model10,Research Indicators,Model,mdl10_1330_price_40_day_mva,mdl10_1330_price_40_day_mva,Simple moving average of closing price over the last 40 trading days,MATRIX,USA,TOP3000,1,0.9971,,,2026-07-16T15:20:39,possible_direction=unknown,40 average closing days indicators last mdl10_1330_price_40_day_mva model model10 moving over possible_direction price research simple trading unknown
model10,Research Indicators,Model,mdl10_1330_price_45_day_mva,mdl10_1330_price_45_day_mva,The 45-day simple moving average of the stock's closing price,MATRIX,USA,TOP3000,1,0.9971,,,2026-07-16T15:20:39,possible_direction=unknown,45 average closing day indicators mdl10_1330_price_45_day_mva model model10 moving possible_direction price research simple stock unknown
model10,Research Indicators,Model,mdl10_1330_price_50_day_mva,mdl10_1330_price_50_day_mva,Simple moving average of closing price over the last 50 trading days,MATRIX,USA,TOP3000,1,0.9971,,,2026-07-16T15:20:39,possible_direction=unknown,50 average closing days indicators last mdl10_1330_price_50_day_mva model model10 moving over possible_direction price research simple trading unknown
model10,Research Indicators,Model,mdl10_1330_price_5_day_mva,mdl10_1330_price_5_day_mva,The 5-day simple moving average of the stock's closing price,MATRIX,USA,TOP3000,1,0.9971,,,2026-07-16T15:20:39,possible_direction=unknown,average closing day indicators mdl10_1330_price_5_day_mva model model10 moving possible_direction price research simple stock unknown
model10,Research Indicators,Model,mdl10_1330_price_65_day_mva,mdl10_1330_price_65_day_mva,Simple moving average of the closing price over the past 65 trading days,MATRIX,USA,TOP3000,1,0.9971,,,2026-07-16T15:20:39,possible_direction=unknown,65 average closing days indicators mdl10_1330_price_65_day_mva model model10 moving over past possible_direction price research simple trading unknown
model10,Research Indicators,Model,mdl10_1330_prior_short_rank,mdl10_1330_prior_short_rank,Short interest percentile rank from the previous reporting period; data updated about biweekly,MATRIX,USA,TOP3000,1,0.976,,,2026-07-16T15:20:39,possible_direction=unknown,about biweekly data from indicators interest mdl10_1330_prior_short_rank model model10 percentile period possible_direction previous rank reporting research short unknown updated
model10,Research Indicators,Model,mdl10_1330_prior_short_ratio,mdl10_1330_prior_short_ratio,Short interest ratio from previous reporting period (typically two weeks ago),MATRIX,USA,TOP3000,1,0.9951,,,2026-07-16T15:20:39,possible_direction=unknown,ago from indicators interest mdl10_1330_prior_short_ratio model model10 period possible_direction previous ratio reporting research short two typically unknown weeks
model10,Research Indicators,Model,mdl10_1330_put_call_erlanger_ratio,mdl10_1330_put_call_erlanger_ratio,"Volume-weighted average price ratio of puts to calls in the stock's options, reflecting options market sentiment",MATRIX,USA,TOP3000,1,0.9522,,,2026-07-16T15:20:39,possible_direction=volume,average calls indicators market mdl10_1330_put_call_erlanger_ratio model model10 options possible_direction price puts ratio reflecting research sentiment stock volume weighted
model10,Research Indicators,Model,mdl10_1330_put_call_erlanger_ratio_10_day,mdl10_1330_put_call_erlanger_ratio_10_day,"10-day median ratio of put option premium to call option premium, measuring the volume-weighted average price relationship between puts and calls for the stock's options",MATRIX,USA,TOP3000,1,0.9507,,,2026-07-16T15:20:39,possible_direction=volume,10 average between call calls day indicators mdl10_1330_put_call_erlanger_ratio_10_day measuring median model model10 option options possible_direction premium price put puts ratio relationship research stock volume weighted
model10,Research Indicators,Model,mdl10_1330_put_call_ratio,mdl10_1330_put_call_ratio,"Ratio of put option volume to call option volume, measures relative put vs. call activity for sentiment",MATRIX,USA,TOP3000,1,0.9522,,,2026-07-16T15:20:39,possible_direction=volume,activity call indicators mdl10_1330_put_call_ratio measures model model10 option possible_direction put ratio relative research sentiment volume vs
model10,Research Indicators,Model,mdl10_1330_put_call_ratio_10_day,mdl10_1330_put_call_ratio_10_day,"10-day median of the ratio of put option volume to call option volume, indicating option sentiment trend over the past 10 days",MATRIX,USA,TOP3000,1,0.9507,,,2026-07-16T15:20:39,possible_direction=volume,10 call day days indicating indicators mdl10_1330_put_call_ratio_10_day median model model10 option over past possible_direction put ratio research sentiment trend volume
model10,Research Indicators,Model,mdl10_1330_put_volume,mdl10_1330_put_volume,Volume of put option contracts traded for the stock on the day,MATRIX,USA,TOP3000,1,0.9522,,,2026-07-16T15:20:39,possible_direction=volume,contracts day indicators mdl10_1330_put_volume model model10 option possible_direction put research stock traded volume
model10,Research Indicators,Model,mdl10_1330_put_volume_10_day,mdl10_1330_put_volume_10_day,10-day median of daily put option contract volume,MATRIX,USA,TOP3000,1,0.9507,,,2026-07-16T15:20:39,possible_direction=volume,10 contract daily day indicators mdl10_1330_put_volume_10_day median model model10 option possible_direction put research volume
model10,Research Indicators,Model,mdl10_1330_rsi_f,mdl10_1330_rsi_f,"Float value of the 14-day Relative Strength Index for the stock, a momentum indicator",MATRIX,USA,TOP3000,1,0.9952,,,2026-07-16T15:20:39,possible_direction=unknown,14 day float index indicator indicators mdl10_1330_rsi_f model model10 momentum possible_direction relative research stock strength unknown value
model10,Research Indicators,Model,mdl10_1330_seasonality,mdl10_1330_seasonality,"A normalized indicator (0-100) of a stock's historical seasonal trading pattern over the calendar year, based on up to 15 years of daily closing prices",MATRIX,USA,TOP3000,1,0.9243,,,2026-07-16T15:20:39,possible_direction=unknown,100 15 based calendar closing daily historical indicator indicators mdl10_1330_seasonality model model10 normalized over pattern possible_direction prices research seasonal stock trading unknown up year years
model10,Research Indicators,Model,mdl10_1330_sector_avg_power_rank,mdl10_1330_sector_avg_power_rank,Average Erlanger Power Rank (sentiment and momentum composite) for the sector,MATRIX,USA,TOP3000,1,0.9955,,,2026-07-16T15:20:39,possible_direction=sentiment,average composite erlanger indicators mdl10_1330_sector_avg_power_rank model model10 momentum possible_direction power rank research sector sentiment
model10,Research Indicators,Model,mdl10_1330_sector_avg_short_rank,mdl10_1330_sector_avg_short_rank,Average Erlanger Short Rank of all issues in the sector,MATRIX,USA,TOP3000,1,0.9955,,,2026-07-16T15:20:39,possible_direction=unknown,all average erlanger indicators issues mdl10_1330_sector_avg_short_rank model model10 possible_direction rank research sector short unknown
model10,Research Indicators,Model,mdl10_1330_sector_avg_tech_rank,mdl10_1330_sector_avg_tech_rank,Average Technical Rank for all stocks in the same sector,MATRIX,USA,TOP3000,1,0.9955,,,2026-07-16T15:20:39,possible_direction=unknown,all average indicators mdl10_1330_sector_avg_tech_rank model model10 possible_direction rank research same sector stocks technical unknown
model10,Research Indicators,Model,mdl10_1330_sector_issue_count,mdl10_1330_sector_issue_count,Number of stocks classified within the sector of the given stock,MATRIX,USA,TOP3000,1,0.9955,,,2026-07-16T15:20:39,possible_direction=unknown,classified given indicators mdl10_1330_sector_issue_count model model10 number possible_direction research sector stock stocks unknown within
model10,Research Indicators,Model,mdl10_1330_sector_issues_above_200_day_avg,mdl10_1330_sector_issues_above_200_day_avg,Number of stocks in the sector with closing price above their 200-day moving average,MATRIX,USA,TOP3000,1,0.9955,,,2026-07-16T15:20:39,possible_direction=unknown,200 above average closing day indicators mdl10_1330_sector_issues_above_200_day_avg model model10 moving number possible_direction price research sector stocks their unknown
model10,Research Indicators,Model,mdl10_1330_sector_issues_above_50_day_avg,mdl10_1330_sector_issues_above_50_day_avg,"Number of issues in the sector with a closing price above their 50-day moving average, a sign of sector strength",MATRIX,USA,TOP3000,1,0.9955,,,2026-07-16T15:20:39,possible_direction=unknown,50 above average closing day indicators issues mdl10_1330_sector_issues_above_50_day_avg model model10 moving number possible_direction price research sector sign strength their unknown
model10,Research Indicators,Model,mdl10_1330_sector_long_squeeze_potential,mdl10_1330_sector_long_squeeze_potential,"Sum of the percentages of sector issues classified as Type 2 (Recognized Strength) and Type 4 (Long Squeeze), indicating sector-wide long squeeze likelihood",MATRIX,USA,TOP3000,1,0.9955,,,2026-07-16T15:20:39,possible_direction=unknown,as classified indicating indicators issues likelihood long mdl10_1330_sector_long_squeeze_potential model model10 percentages possible_direction recognized research sector squeeze strength sum type unknown wide
