"dataset_id","dataset_name","dataset_category","field_id","field_name","description","field_type","region","universe","delay","coverage","user_permission","permission_level","last_seen","notes"
"model12","Stock Selection Model","Model","mdl12_1mt","mdl12_1mt","A combined tactical alpha score (1-100), calculated as a weighted integration of the reversal, momentum, liquidity, and seasonality component scores, reflecting the overall short-term return potential for the stock","MATRIX","USA","TOP3000","1","0.9966","","","2026-07-16T15:20:39","possible_direction=volume"
"model12","Stock Selection Model","Model","mdl12_factor_momentum_component","mdl12_factor_momentum_component","A percentile-ranked score (1-100) representing short-term momentum signals for a stock, with higher scores suggesting stronger recent price momentum that might persist","MATRIX","USA","TOP3000","1","0.9966","","","2026-07-16T15:20:39","possible_direction=unknown"
"model12","Stock Selection Model","Model","mdl12_liquidity_shock_component","mdl12_liquidity_shock_component","A percentile-ranked score (1-100) measuring the extent of recent liquidity events or microstructure shocks for a stock, with higher values indicating a stronger liquidity-driven potential for alpha","MATRIX","USA","TOP3000","1","0.9966","","","2026-07-16T15:20:39","possible_direction=volume"
"model12","Stock Selection Model","Model","mdl12_reversal_component","mdl12_reversal_component","A percentile-ranked score (1-100) indicating the degree to which a stock is expected to experience price reversal or mean-reversion, with higher values suggesting greater likelihood of outperformance due to reversal effects","MATRIX","USA","TOP3000","1","0.9966","","","2026-07-16T15:20:39","possible_direction=unknown"
"model12","Stock Selection Model","Model","mdl12_seasonality_component","mdl12_seasonality_component","A percentile-ranked score (1-100) capturing seasonal or calendar-based effects which may impact a stock's short-term returns; higher scores indicate stronger positive seasonality signals","MATRIX","USA","TOP3000","1","0.9966","","","2026-07-16T15:20:39","possible_direction=unknown"
