dataset_id,dataset_name,dataset_category,field_id,field_name,description,field_type,region,universe,delay,coverage,user_permission,permission_level,last_seen,notes,keywords
model10,Research Indicators,Model,mdl10_1130_price_50_day_mva,mdl10_1130_price_50_day_mva,50-day moving average of the closing price,MATRIX,USA,TOP3000,1,0.9971,,,2026-07-16T15:20:39,possible_direction=unknown,50 average closing day indicators mdl10_1130_price_50_day_mva model model10 moving possible_direction price research unknown
model10,Research Indicators,Model,mdl10_1130_price_5_day_mva,mdl10_1130_price_5_day_mva,Simple moving average of the closing price over the past 5 trading days,MATRIX,USA,TOP3000,1,0.9971,,,2026-07-16T15:20:39,possible_direction=unknown,average closing days indicators mdl10_1130_price_5_day_mva model model10 moving over past possible_direction price research simple trading unknown
model10,Research Indicators,Model,mdl10_1130_price_65_day_mva,mdl10_1130_price_65_day_mva,65-day moving average of the stock's closing price,MATRIX,USA,TOP3000,1,0.9971,,,2026-07-16T15:20:39,possible_direction=unknown,65 average closing day indicators mdl10_1130_price_65_day_mva model model10 moving possible_direction price research stock unknown
model10,Research Indicators,Model,mdl10_1130_prior_short_rank,mdl10_1130_prior_short_rank,"Stock's short interest rank for the previous reporting period (about two weeks prior), used to track changes in short sentiment over time",MATRIX,USA,TOP3000,1,0.976,,,2026-07-16T15:20:39,possible_direction=sentiment,about changes indicators interest mdl10_1130_prior_short_rank model model10 over period possible_direction previous prior rank reporting research sentiment short stock time track two used weeks
model10,Research Indicators,Model,mdl10_1130_prior_short_ratio,mdl10_1130_prior_short_ratio,Short interest ratio from the previous reporting period,MATRIX,USA,TOP3000,1,0.9951,,,2026-07-16T15:20:39,possible_direction=unknown,from indicators interest mdl10_1130_prior_short_ratio model model10 period possible_direction previous ratio reporting research short unknown
model10,Research Indicators,Model,mdl10_1130_put_call_erlanger_ratio,mdl10_1130_put_call_erlanger_ratio,"Volume-weighted average ratio of put option prices to call option prices, a proprietary measure reflecting options market sentiment for the stock",MATRIX,USA,TOP3000,1,0.9522,,,2026-07-16T15:20:39,possible_direction=volume,average call indicators market mdl10_1130_put_call_erlanger_ratio measure model model10 option options possible_direction prices proprietary put ratio reflecting research sentiment stock volume weighted
model10,Research Indicators,Model,mdl10_1130_put_call_erlanger_ratio_10_day,mdl10_1130_put_call_erlanger_ratio_10_day,"10-day median of the ratio of put to call option premiums, calculated as volume-weighted average price of a stock’s options",MATRIX,USA,TOP3000,1,0.9507,,,2026-07-16T15:20:39,possible_direction=volume,10 as average calculated call day indicators mdl10_1130_put_call_erlanger_ratio_10_day median model model10 option options possible_direction premiums price put ratio research stock volume weighted
model10,Research Indicators,Model,mdl10_1130_put_call_ratio,mdl10_1130_put_call_ratio,Ratio of put option volume to call option volume for the day,MATRIX,USA,TOP3000,1,0.9522,,,2026-07-16T15:20:39,possible_direction=volume,call day indicators mdl10_1130_put_call_ratio model model10 option possible_direction put ratio research volume
model10,Research Indicators,Model,mdl10_1130_put_call_ratio_10_day,mdl10_1130_put_call_ratio_10_day,10-day median of put option volume to call option volume,MATRIX,USA,TOP3000,1,0.9507,,,2026-07-16T15:20:39,possible_direction=volume,10 call day indicators mdl10_1130_put_call_ratio_10_day median model model10 option possible_direction put research volume
model10,Research Indicators,Model,mdl10_1130_put_volume,mdl10_1130_put_volume,Number of put option contracts traded for the issue on the current day,MATRIX,USA,TOP3000,1,0.9522,,,2026-07-16T15:20:39,possible_direction=volume,contracts current day indicators issue mdl10_1130_put_volume model model10 number option possible_direction put research traded volume
model10,Research Indicators,Model,mdl10_1130_put_volume_10_day,mdl10_1130_put_volume_10_day,"Median daily put option volume over the trailing 10 days, measured per contract",MATRIX,USA,TOP3000,1,0.9507,,,2026-07-16T15:20:39,possible_direction=volume,10 contract daily days indicators mdl10_1130_put_volume_10_day measured median model model10 option over per possible_direction put research trailing volume
model10,Research Indicators,Model,mdl10_1130_rsi_f,mdl10_1130_rsi_f,"14-day Relative Strength Index (RSI), float variant, used to gauge momentum and potential overbought/oversold conditions",MATRIX,USA,TOP3000,1,0.9952,,,2026-07-16T15:20:39,possible_direction=unknown,14 conditions day float gauge index indicators mdl10_1130_rsi_f model model10 momentum overbought oversold possible_direction potential relative research rsi strength unknown used variant
model10,Research Indicators,Model,mdl10_1130_seasonality,mdl10_1130_seasonality,"Composite score (0–100) indicating the historical seasonal tendency of a stock, based on up to 15 years of daily closing price data; higher values suggest seasonally stronger periods",MATRIX,USA,TOP3000,1,0.9243,,,2026-07-16T15:20:39,possible_direction=unknown,100 15 based closing composite daily data higher historical indicating indicators mdl10_1130_seasonality model model10 periods possible_direction price research score seasonal seasonally stock stronger suggest tendency unknown up values years
model10,Research Indicators,Model,mdl10_1130_sector_avg_power_rank,mdl10_1130_sector_avg_power_rank,"Average Erlanger Power Rank for all stocks within the sector, summarizing composite technical and sentiment strength",MATRIX,USA,TOP3000,1,0.9955,,,2026-07-16T15:20:39,possible_direction=sentiment,all average composite erlanger indicators mdl10_1130_sector_avg_power_rank model model10 possible_direction power rank research sector sentiment stocks strength summarizing technical within
model10,Research Indicators,Model,mdl10_1130_sector_avg_short_rank,mdl10_1130_sector_avg_short_rank,Average Erlanger Short Rank across all stocks in the sector,MATRIX,USA,TOP3000,1,0.9955,,,2026-07-16T15:20:39,possible_direction=unknown,across all average erlanger indicators mdl10_1130_sector_avg_short_rank model model10 possible_direction rank research sector short stocks unknown
model10,Research Indicators,Model,mdl10_1130_sector_avg_tech_rank,mdl10_1130_sector_avg_tech_rank,"Average technical strength rank of all stocks within the sector, indicating the sector's overall technical momentum on a normalized scale",MATRIX,USA,TOP3000,1,0.9955,,,2026-07-16T15:20:39,possible_direction=unknown,all average indicating indicators mdl10_1130_sector_avg_tech_rank model model10 momentum normalized overall possible_direction rank research scale sector stocks strength technical unknown within
model10,Research Indicators,Model,mdl10_1130_sector_issue_count,mdl10_1130_sector_issue_count,Number of stocks classified in the corresponding Sector,MATRIX,USA,TOP3000,1,0.9955,,,2026-07-16T15:20:39,possible_direction=unknown,classified corresponding indicators mdl10_1130_sector_issue_count model model10 number possible_direction research sector stocks unknown
model10,Research Indicators,Model,mdl10_1130_sector_issues_above_200_day_avg,mdl10_1130_sector_issues_above_200_day_avg,Number of stocks in the sector currently trading above their 200-day moving average closing price,MATRIX,USA,TOP3000,1,0.9955,,,2026-07-16T15:20:39,possible_direction=unknown,200 above average closing currently day indicators mdl10_1130_sector_issues_above_200_day_avg model model10 moving number possible_direction price research sector stocks their trading unknown
model10,Research Indicators,Model,mdl10_1130_sector_issues_above_50_day_avg,mdl10_1130_sector_issues_above_50_day_avg,Number of stocks in the sector trading above their 50-day moving average for closing price,MATRIX,USA,TOP3000,1,0.9955,,,2026-07-16T15:20:39,possible_direction=unknown,50 above average closing day indicators mdl10_1130_sector_issues_above_50_day_avg model model10 moving number possible_direction price research sector stocks their trading unknown
model10,Research Indicators,Model,mdl10_1130_sector_long_squeeze_potential,mdl10_1130_sector_long_squeeze_potential,"Sum of Sector Type 2 and Sector Type 4 percentages, representing long squeeze risk/opportunity for the entire sector",MATRIX,USA,TOP3000,1,0.9955,,,2026-07-16T15:20:39,possible_direction=unknown,entire indicators long mdl10_1130_sector_long_squeeze_potential model model10 opportunity percentages possible_direction representing research risk sector squeeze sum type unknown
model10,Research Indicators,Model,mdl10_1130_sector_rank,mdl10_1130_sector_rank,"Sector's relative ranking among 18 sectors, with 1 being most positive and 18 most negative, comparing overall current conditions across sectors",MATRIX,USA,TOP3000,1,0.9955,,,2026-07-16T15:20:39,possible_direction=unknown,18 across among being comparing conditions current indicators mdl10_1130_sector_rank model model10 most negative overall positive possible_direction ranking relative research sector sectors unknown
model10,Research Indicators,Model,mdl10_1130_sector_short_squeeze_potential,mdl10_1130_sector_short_squeeze_potential,"Sum of percentage of stocks in the sector with short squeeze potential, calculated by adding Sector Type 1% and Sector Type 3%",MATRIX,USA,TOP3000,1,0.9955,,,2026-07-16T15:20:39,possible_direction=unknown,adding by calculated indicators mdl10_1130_sector_short_squeeze_potential model model10 percentage possible_direction potential research sector short squeeze stocks sum type unknown
model10,Research Indicators,Model,mdl10_1130_sector_type_1,mdl10_1130_sector_type_1,"Percentage of stocks in the sector currently classified as Type 1 (""Short Squeeze""), indicating prevalence of short squeeze conditions",MATRIX,USA,TOP3000,1,0.9955,,,2026-07-16T15:20:39,possible_direction=unknown,as classified conditions currently indicating indicators mdl10_1130_sector_type_1 model model10 percentage possible_direction prevalence research sector short squeeze stocks type unknown
model10,Research Indicators,Model,mdl10_1130_sector_type_2,mdl10_1130_sector_type_2,Percentage of stocks in the sector currently classified as Type 2 (Recognized Strength),MATRIX,USA,TOP3000,1,0.9955,,,2026-07-16T15:20:39,possible_direction=unknown,as classified currently indicators mdl10_1130_sector_type_2 model model10 percentage possible_direction recognized research sector stocks strength type unknown
model10,Research Indicators,Model,mdl10_1130_sector_type_3,mdl10_1130_sector_type_3,"Percentage of stocks in an Erlanger Sector currently classified as Type 3 (""Shorts Are Right"")",MATRIX,USA,TOP3000,1,0.9955,,,2026-07-16T15:20:39,possible_direction=unknown,are as classified currently erlanger indicators mdl10_1130_sector_type_3 model model10 percentage possible_direction research right sector shorts stocks type unknown
model10,Research Indicators,Model,mdl10_1130_sector_type_4,mdl10_1130_sector_type_4,"Percentage of stocks in an Erlanger Sector currently classified as Type 4 (""Long Squeeze"")",MATRIX,USA,TOP3000,1,0.9955,,,2026-07-16T15:20:39,possible_direction=unknown,as classified currently erlanger indicators long mdl10_1130_sector_type_4 model model10 percentage possible_direction research sector squeeze stocks type unknown
model10,Research Indicators,Model,mdl10_1130_shares_outstanding,mdl10_1130_shares_outstanding,Total number of shares currently issued by the company,MATRIX,USA,TOP3000,1,0.9474,,,2026-07-16T15:20:39,possible_direction=unknown,by company currently indicators issued mdl10_1130_shares_outstanding model model10 number possible_direction research shares total unknown
model10,Research Indicators,Model,mdl10_1130_shares_outstanding_l,mdl10_1130_shares_outstanding_l,Total number of shares outstanding for the stock (in long integer format),MATRIX,USA,TOP3000,1,0.9474,,,2026-07-16T15:20:39,possible_direction=unknown,format indicators integer long mdl10_1130_shares_outstanding_l model model10 number outstanding possible_direction research shares stock total unknown
model10,Research Indicators,Model,mdl10_1130_short_heat,mdl10_1130_short_heat,Percentage of prior years when the current date overlapped with a seasonal weak (short) zone for the stock,MATRIX,USA,TOP3000,1,0.9243,,,2026-07-16T15:20:39,possible_direction=unknown,current date indicators mdl10_1130_short_heat model model10 overlapped percentage possible_direction prior research seasonal short stock unknown weak when years zone
model10,Research Indicators,Model,mdl10_1130_short_rank,mdl10_1130_short_rank,"Percentile rank (weighted from 100 to 0) of current Erlanger Short Ratio versus historical values, indicating current short interest intensity",MATRIX,USA,TOP3000,1,0.978,,,2026-07-16T15:20:39,possible_direction=unknown,100 current erlanger from historical indicating indicators intensity interest mdl10_1130_short_rank model model10 percentile possible_direction rank ratio research short unknown values versus weighted
model10,Research Indicators,Model,mdl10_1130_short_ratio,mdl10_1130_short_ratio,"Ratio of current short interest to average daily volume (12-month trailing), measuring short selling activity",MATRIX,USA,TOP3000,1,0.9971,,,2026-07-16T15:20:39,possible_direction=volume,12 activity average current daily indicators interest mdl10_1130_short_ratio measuring model model10 month possible_direction ratio research selling short trailing volume
model10,Research Indicators,Model,mdl10_1130_short_zone_days,mdl10_1130_short_zone_days,"Number of days remaining in the current seasonal ""short zone"" for the stock",MATRIX,USA,TOP3000,1,0.9243,,,2026-07-16T15:20:39,possible_direction=unknown,current days indicators mdl10_1130_short_zone_days model model10 number possible_direction remaining research seasonal short stock unknown zone
model10,Research Indicators,Model,mdl10_1130_short_zone_juice,mdl10_1130_short_zone_juice,"Difference between the seasonal cycle value at the end of the current short zone and the value on the current date, indicating momentum/strength of the short zone",MATRIX,USA,TOP3000,1,0.9243,,,2026-07-16T15:20:39,possible_direction=unknown,at between current cycle date difference end indicating indicators mdl10_1130_short_zone_juice model model10 momentum possible_direction research seasonal short strength unknown value zone
model10,Research Indicators,Model,mdl10_1130_short_zone_rank,mdl10_1130_short_zone_rank,"Ratio of Short Zone Juice to Short Zone Days Remaining, representing rank within the seasonal short zone period",MATRIX,USA,TOP3000,1,0.9243,,,2026-07-16T15:20:39,possible_direction=unknown,days indicators juice mdl10_1130_short_zone_rank model model10 period possible_direction rank ratio remaining representing research seasonal short unknown within zone
model10,Research Indicators,Model,mdl10_1130_tech_rank,mdl10_1130_tech_rank,"Technical strength rank of the stock, measured from 10 to 100 based on proprietary analysis of price movements over the past 100 days",MATRIX,USA,TOP3000,1,0.9832,,,2026-07-16T15:20:39,possible_direction=unknown,10 100 analysis based days from indicators mdl10_1130_tech_rank measured model model10 movements over past possible_direction price proprietary rank research stock strength technical unknown
model10,Research Indicators,Model,mdl10_1130_technical_dma_high,mdl10_1130_technical_dma_high,6-day simple moving average of the equity’s daily high price,MATRIX,USA,TOP3000,1,0.9971,,,2026-07-16T15:20:39,possible_direction=unknown,average daily day equity high indicators mdl10_1130_technical_dma_high model model10 moving possible_direction price research simple unknown
model10,Research Indicators,Model,mdl10_1130_technical_dma_low,mdl10_1130_technical_dma_low,"6-day moving average of the stock's daily low prices, used in technical indicator calculations",MATRIX,USA,TOP3000,1,0.9971,,,2026-07-16T15:20:39,possible_direction=unknown,average calculations daily day indicator indicators low mdl10_1130_technical_dma_low model model10 moving possible_direction prices research stock technical unknown used
model10,Research Indicators,Model,mdl10_1130_type,mdl10_1130_type,"Categorical indicator of current technical and short interest setup (Short Squeeze, Recognized Strength, Shorts Are Right, Long Squeeze), based on thresholds for technical rank, short interest rank, and short ratio",MATRIX,USA,TOP3000,1,0.8015,,,2026-07-16T15:20:39,possible_direction=unknown,are based categorical current indicator indicators interest long mdl10_1130_type model model10 possible_direction rank ratio recognized research right setup short shorts squeeze strength technical thresholds unknown
model10,Research Indicators,Model,mdl10_1130_volume,mdl10_1130_volume,"Daily trading volume of the issue, measured in hundreds of shares",MATRIX,USA,TOP3000,1,0.9977,,,2026-07-16T15:20:39,possible_direction=volume,daily hundreds indicators issue mdl10_1130_volume measured model model10 possible_direction research shares trading volume
model10,Research Indicators,Model,mdl10_1200_avg_daily_volume,mdl10_1200_avg_daily_volume,Average daily trading volume reported over the last 12 months,MATRIX,USA,TOP3000,1,0.9972,,,2026-07-16T15:20:39,possible_direction=volume,12 average daily indicators last mdl10_1200_avg_daily_volume model model10 months over possible_direction reported research trading volume
model10,Research Indicators,Model,mdl10_1200_call_put_erlanger_ratio,mdl10_1200_call_put_erlanger_ratio,"Proprietary premium ratio: volume-weighted average price of call options relative to puts, reflecting sentiment",MATRIX,USA,TOP3000,1,0.9522,,,2026-07-16T15:20:39,possible_direction=volume,average call indicators mdl10_1200_call_put_erlanger_ratio model model10 options possible_direction premium price proprietary puts ratio reflecting relative research sentiment volume weighted
model10,Research Indicators,Model,mdl10_1200_call_put_erlanger_ratio_10_day,mdl10_1200_call_put_erlanger_ratio_10_day,"10-day median of ratio of call to put option premiums, volume weighted, indicator of options sentiment",MATRIX,USA,TOP3000,1,0.9507,,,2026-07-16T15:20:39,possible_direction=volume,10 call day indicator indicators mdl10_1200_call_put_erlanger_ratio_10_day median model model10 option options possible_direction premiums put ratio research sentiment volume weighted
model10,Research Indicators,Model,mdl10_1200_call_put_ratio,mdl10_1200_call_put_ratio,Ratio of call option volume to put option volume for the day,MATRIX,USA,TOP3000,1,0.9522,,,2026-07-16T15:20:39,possible_direction=volume,call day indicators mdl10_1200_call_put_ratio model model10 option possible_direction put ratio research volume
model10,Research Indicators,Model,mdl10_1200_call_put_ratio_10_day,mdl10_1200_call_put_ratio_10_day,10-day median of ratio of call to put option volume,MATRIX,USA,TOP3000,1,0.9507,,,2026-07-16T15:20:39,possible_direction=volume,10 call day indicators mdl10_1200_call_put_ratio_10_day median model model10 option possible_direction put ratio research volume
model10,Research Indicators,Model,mdl10_1200_call_volume,mdl10_1200_call_volume,Number of call option contracts traded daily,MATRIX,USA,TOP3000,1,0.9522,,,2026-07-16T15:20:39,possible_direction=volume,call contracts daily indicators mdl10_1200_call_volume model model10 number option possible_direction research traded volume
model10,Research Indicators,Model,mdl10_1200_call_volume_10_day,mdl10_1200_call_volume_10_day,10-day median of daily call option trading volume per contract,MATRIX,USA,TOP3000,1,0.9507,,,2026-07-16T15:20:39,possible_direction=volume,10 call contract daily day indicators mdl10_1200_call_volume_10_day median model model10 option per possible_direction research trading volume
model10,Research Indicators,Model,mdl10_1200_chop,mdl10_1200_chop,14-day Choppiness Index quantifying trendiness vs. choppiness (higher values = more sideways/choppy; lower = trending),MATRIX,USA,TOP3000,1,0.9969,,,2026-07-16T15:20:39,possible_direction=unknown,14 choppiness choppy day higher index indicators lower mdl10_1200_chop model model10 more possible_direction quantifying research sideways trendiness trending unknown values vs
model10,Research Indicators,Model,mdl10_1200_close,mdl10_1200_close,Closing price for the trading day,MATRIX,USA,TOP3000,1,0.9977,,,2026-07-16T15:20:39,possible_direction=unknown,closing day indicators mdl10_1200_close model model10 possible_direction price research trading unknown
model10,Research Indicators,Model,mdl10_1200_erlanger_option_rank,mdl10_1200_erlanger_option_rank,"Proprietary rank measuring overbought/oversold status using options data, volume, open interest, and price behaviors",MATRIX,USA,TOP3000,1,0.9453,,,2026-07-16T15:20:39,possible_direction=volume,behaviors data indicators interest mdl10_1200_erlanger_option_rank measuring model model10 open options overbought oversold possible_direction price proprietary rank research status using volume
model10,Research Indicators,Model,mdl10_1200_float,mdl10_1200_float,Number of shares outstanding that are available for public trading,MATRIX,USA,TOP3000,1,0.9925,,,2026-07-16T15:20:39,possible_direction=unknown,are available indicators mdl10_1200_float model model10 number outstanding possible_direction public research shares that trading unknown
model10,Research Indicators,Model,mdl10_1200_future_juice_10_days,mdl10_1200_future_juice_10_days,Projected change in the seasonal cycle index for the stock over the next 10 trading days (rise or fall in typical seasonality),MATRIX,USA,TOP3000,1,0.9243,,,2026-07-16T15:20:39,possible_direction=unknown,10 change cycle days fall index indicators mdl10_1200_future_juice_10_days model model10 next over possible_direction projected research rise seasonal seasonality stock trading typical unknown
model10,Research Indicators,Model,mdl10_1200_future_juice_20_days,mdl10_1200_future_juice_20_days,Projected change in seasonal trend score over next 20 trading days,MATRIX,USA,TOP3000,1,0.9243,,,2026-07-16T15:20:39,possible_direction=unknown,20 change days indicators mdl10_1200_future_juice_20_days model model10 next over possible_direction projected research score seasonal trading trend unknown
model10,Research Indicators,Model,mdl10_1200_future_juice_40_days,mdl10_1200_future_juice_40_days,"Difference between current and 40-day forward seasonal cycle value, measures expected seasonal trend strength",MATRIX,USA,TOP3000,1,0.9243,,,2026-07-16T15:20:39,possible_direction=unknown,40 between current cycle day difference expected forward indicators mdl10_1200_future_juice_40_days measures model model10 possible_direction research seasonal strength trend unknown value
model10,Research Indicators,Model,mdl10_1200_group_avg_power_rank,mdl10_1200_group_avg_power_rank,"Average Erlanger Power Rank for all stocks in the given group, summarizing group-level technical and short interest sentiment",MATRIX,USA,TOP3000,1,0.9955,,,2026-07-16T15:20:39,possible_direction=sentiment,all average erlanger given group indicators interest level mdl10_1200_group_avg_power_rank model model10 possible_direction power rank research sentiment short stocks summarizing technical
model10,Research Indicators,Model,mdl10_1200_group_avg_short_rank,mdl10_1200_group_avg_short_rank,Average Erlanger Short Rank value for the industry group to which the stock belongs,MATRIX,USA,TOP3000,1,0.9955,,,2026-07-16T15:20:39,possible_direction=unknown,average belongs erlanger group indicators industry mdl10_1200_group_avg_short_rank model model10 possible_direction rank research short stock unknown value which
model10,Research Indicators,Model,mdl10_1200_group_avg_tech_rank,mdl10_1200_group_avg_tech_rank,Average Erlanger Technical Rank of all issues in the group,MATRIX,USA,TOP3000,1,0.9955,,,2026-07-16T15:20:39,possible_direction=unknown,all average erlanger group indicators issues mdl10_1200_group_avg_tech_rank model model10 possible_direction rank research technical unknown
model10,Research Indicators,Model,mdl10_1200_group_issue_count,mdl10_1200_group_issue_count,Number of stocks in the corresponding group,MATRIX,USA,TOP3000,1,0.9955,,,2026-07-16T15:20:39,possible_direction=unknown,corresponding group indicators mdl10_1200_group_issue_count model model10 number possible_direction research stocks unknown
model10,Research Indicators,Model,mdl10_1200_group_issues_above_200_day_avg,mdl10_1200_group_issues_above_200_day_avg,Number of issues in the group with closing price above the 200-day moving average,MATRIX,USA,TOP3000,1,0.9955,,,2026-07-16T15:20:39,possible_direction=unknown,200 above average closing day group indicators issues mdl10_1200_group_issues_above_200_day_avg model model10 moving number possible_direction price research unknown
model10,Research Indicators,Model,mdl10_1200_group_issues_above_50_day_avg,mdl10_1200_group_issues_above_50_day_avg,Number of group issues with closing price above 50-day moving average,MATRIX,USA,TOP3000,1,0.9955,,,2026-07-16T15:20:39,possible_direction=unknown,50 above average closing day group indicators issues mdl10_1200_group_issues_above_50_day_avg model model10 moving number possible_direction price research unknown
model10,Research Indicators,Model,mdl10_1200_group_long_squeeze_potential,mdl10_1200_group_long_squeeze_potential,Sum of percentages in the group classified as Type 2 and Type 4 (potential for long squeeze),MATRIX,USA,TOP3000,1,0.9955,,,2026-07-16T15:20:39,possible_direction=unknown,as classified group indicators long mdl10_1200_group_long_squeeze_potential model model10 percentages possible_direction potential research squeeze sum type unknown
