dataset_id,dataset_name,dataset_category,field_id,field_name,description,field_type,region,universe,delay,coverage,user_permission,permission_level,last_seen,notes,keywords
model10,Research Indicators,Model,mdl10_1430_tech_rank,mdl10_1430_tech_rank,"Technical strength ranking (10–100), based on proprietary pattern recognition analyzing weighted price moves over the past 100 trading days",MATRIX,USA,TOP3000,1,0.9832,,,2026-07-16T15:20:39,possible_direction=unknown,10 100 analyzing based days indicators mdl10_1430_tech_rank model model10 moves over past pattern possible_direction price proprietary ranking recognition research strength technical trading unknown weighted
model10,Research Indicators,Model,mdl10_1430_technical_dma_high,mdl10_1430_technical_dma_high,6-day moving average of the stock's daily high price,MATRIX,USA,TOP3000,1,0.9971,,,2026-07-16T15:20:39,possible_direction=unknown,average daily day high indicators mdl10_1430_technical_dma_high model model10 moving possible_direction price research stock unknown
model10,Research Indicators,Model,mdl10_1430_technical_dma_low,mdl10_1430_technical_dma_low,6-day moving average of the stock's daily low prices; technical indicator for support levels,MATRIX,USA,TOP3000,1,0.9971,,,2026-07-16T15:20:39,possible_direction=unknown,average daily day indicator indicators levels low mdl10_1430_technical_dma_low model model10 moving possible_direction prices research stock support technical unknown
model10,Research Indicators,Model,mdl10_1430_type,mdl10_1430_type,"Stock classification code reflecting combined technical and short interest signals, with associated trading suggestions",MATRIX,USA,TOP3000,1,0.8015,,,2026-07-16T15:20:39,possible_direction=unknown,associated classification code combined indicators interest mdl10_1430_type model model10 possible_direction reflecting research short signals stock suggestions technical trading unknown
model10,Research Indicators,Model,mdl10_1430_volume,mdl10_1430_volume,"Daily trading volume for the issue, measured in hundreds of shares",MATRIX,USA,TOP3000,1,0.9977,,,2026-07-16T15:20:39,possible_direction=volume,daily hundreds indicators issue mdl10_1430_volume measured model model10 possible_direction research shares trading volume
model10,Research Indicators,Model,mdl10_1500_avg_daily_volume,mdl10_1500_avg_daily_volume,Average daily volume over the past 12 months as reported by exchanges,MATRIX,USA,TOP3000,1,0.9972,,,2026-07-16T15:20:39,possible_direction=volume,12 as average by daily exchanges indicators mdl10_1500_avg_daily_volume model model10 months over past possible_direction reported research volume
model10,Research Indicators,Model,mdl10_1500_call_put_erlanger_ratio,mdl10_1500_call_put_erlanger_ratio,Volume weighted average price ratio of call options to put options for the stock,MATRIX,USA,TOP3000,1,0.9522,,,2026-07-16T15:20:39,possible_direction=volume,average call indicators mdl10_1500_call_put_erlanger_ratio model model10 options possible_direction price put ratio research stock volume weighted
model10,Research Indicators,Model,mdl10_1500_call_put_erlanger_ratio_10_day,mdl10_1500_call_put_erlanger_ratio_10_day,10-day median of call to put premium ratio for the options,MATRIX,USA,TOP3000,1,0.9507,,,2026-07-16T15:20:39,possible_direction=unknown,10 call day indicators mdl10_1500_call_put_erlanger_ratio_10_day median model model10 options possible_direction premium put ratio research unknown
model10,Research Indicators,Model,mdl10_1500_call_put_ratio,mdl10_1500_call_put_ratio,"Ratio of call options volume to put options volume for the current day, showing bullish/bearish sentiment",MATRIX,USA,TOP3000,1,0.9522,,,2026-07-16T15:20:39,possible_direction=volume,bearish bullish call current day indicators mdl10_1500_call_put_ratio model model10 options possible_direction put ratio research sentiment showing volume
model10,Research Indicators,Model,mdl10_1500_call_put_ratio_10_day,mdl10_1500_call_put_ratio_10_day,"Median ratio of call option volume to put option volume, calculated over the past 10 days",MATRIX,USA,TOP3000,1,0.9507,,,2026-07-16T15:20:39,possible_direction=volume,10 calculated call days indicators mdl10_1500_call_put_ratio_10_day median model model10 option over past possible_direction put ratio research volume
model10,Research Indicators,Model,mdl10_1500_call_volume,mdl10_1500_call_volume,Daily traded call option contracts for the stock,MATRIX,USA,TOP3000,1,0.9522,,,2026-07-16T15:20:39,possible_direction=volume,call contracts daily indicators mdl10_1500_call_volume model model10 option possible_direction research stock traded volume
model10,Research Indicators,Model,mdl10_1500_call_volume_10_day,mdl10_1500_call_volume_10_day,"10-day median of daily call option volume, smoothing out volatility in call option trading volume",MATRIX,USA,TOP3000,1,0.9507,,,2026-07-16T15:20:39,possible_direction=volume,10 call daily day indicators mdl10_1500_call_volume_10_day median model model10 option out possible_direction research smoothing trading volatility volume
model10,Research Indicators,Model,mdl10_1500_chop,mdl10_1500_chop,"14-day choppiness index based on chaos theory, measures how choppy (range-bound) or trending the price movement is",MATRIX,USA,TOP3000,1,0.997,,,2026-07-16T15:20:39,possible_direction=unknown,14 based bound chaos choppiness choppy day how index indicators is mdl10_1500_chop measures model model10 movement possible_direction price range research theory trending unknown
model10,Research Indicators,Model,mdl10_1500_close,mdl10_1500_close,Price at which the stock closed for the trading day,MATRIX,USA,TOP3000,1,0.9977,,,2026-07-16T15:20:39,possible_direction=unknown,at closed day indicators mdl10_1500_close model model10 possible_direction price research stock trading unknown which
model10,Research Indicators,Model,mdl10_1500_erlanger_option_rank,mdl10_1500_erlanger_option_rank,"Indicator of overbought/oversold conditions using options activity and sentiment; based on volume, price, strike, open interest, and money flow",MATRIX,USA,TOP3000,1,0.9453,,,2026-07-16T15:20:39,possible_direction=volume,activity based conditions flow indicator indicators interest mdl10_1500_erlanger_option_rank model model10 money open options overbought oversold possible_direction price research sentiment strike using volume
model10,Research Indicators,Model,mdl10_1500_float,mdl10_1500_float,Number of shares outstanding that are available for public trading,MATRIX,USA,TOP3000,1,0.9925,,,2026-07-16T15:20:39,possible_direction=unknown,are available indicators mdl10_1500_float model model10 number outstanding possible_direction public research shares that trading unknown
model10,Research Indicators,Model,mdl10_1500_future_juice_10_days,mdl10_1500_future_juice_10_days,Difference in the seasonal cycle value for a stock between today and 10 trading days ahead; predicts seasonal momentum over the next 10 days,MATRIX,USA,TOP3000,1,0.9243,,,2026-07-16T15:20:39,possible_direction=unknown,10 ahead between cycle days difference indicators mdl10_1500_future_juice_10_days model model10 momentum next over possible_direction predicts research seasonal stock today trading unknown value
model10,Research Indicators,Model,mdl10_1500_future_juice_20_days,mdl10_1500_future_juice_20_days,Difference in the seasonal cycle value for a stock between today and 20 trading days ahead; predicts momentum over the next 20 days,MATRIX,USA,TOP3000,1,0.9243,,,2026-07-16T15:20:39,possible_direction=unknown,20 ahead between cycle days difference indicators mdl10_1500_future_juice_20_days model model10 momentum next over possible_direction predicts research seasonal stock today trading unknown value
model10,Research Indicators,Model,mdl10_1500_future_juice_40_days,mdl10_1500_future_juice_40_days,"Difference in the seasonal cycle index for the stock 40 trading days in the future minus current value, indicating expected seasonal strength or weakness",MATRIX,USA,TOP3000,1,0.9243,,,2026-07-16T15:20:39,possible_direction=unknown,40 current cycle days difference expected future index indicating indicators mdl10_1500_future_juice_40_days minus model model10 possible_direction research seasonal stock strength trading unknown value weakness
model10,Research Indicators,Model,mdl10_1500_group_avg_power_rank,mdl10_1500_group_avg_power_rank,Average composite Power Rank for all stocks in the industry group,MATRIX,USA,TOP3000,1,0.9955,,,2026-07-16T15:20:39,possible_direction=unknown,all average composite group indicators industry mdl10_1500_group_avg_power_rank model model10 possible_direction power rank research stocks unknown
model10,Research Indicators,Model,mdl10_1500_group_avg_short_rank,mdl10_1500_group_avg_short_rank,Average Short Rank for all stocks within the industry group,MATRIX,USA,TOP3000,1,0.9955,,,2026-07-16T15:20:39,possible_direction=unknown,all average group indicators industry mdl10_1500_group_avg_short_rank model model10 possible_direction rank research short stocks unknown within
model10,Research Indicators,Model,mdl10_1500_group_avg_tech_rank,mdl10_1500_group_avg_tech_rank,Average Technical Rank of all stocks in the group,MATRIX,USA,TOP3000,1,0.9955,,,2026-07-16T15:20:39,possible_direction=unknown,all average group indicators mdl10_1500_group_avg_tech_rank model model10 possible_direction rank research stocks technical unknown
model10,Research Indicators,Model,mdl10_1500_group_issue_count,mdl10_1500_group_issue_count,Number of stocks that are classified in the same Erlanger Group as the current stock,MATRIX,USA,TOP3000,1,0.9955,,,2026-07-16T15:20:39,possible_direction=unknown,are as classified current erlanger group indicators mdl10_1500_group_issue_count model model10 number possible_direction research same stock stocks that unknown
model10,Research Indicators,Model,mdl10_1500_group_issues_above_200_day_avg,mdl10_1500_group_issues_above_200_day_avg,Number of stocks in the Erlanger Group with closing prices above their 200-day moving average,MATRIX,USA,TOP3000,1,0.9955,,,2026-07-16T15:20:39,possible_direction=unknown,200 above average closing day erlanger group indicators mdl10_1500_group_issues_above_200_day_avg model model10 moving number possible_direction prices research stocks their unknown
model10,Research Indicators,Model,mdl10_1500_group_issues_above_50_day_avg,mdl10_1500_group_issues_above_50_day_avg,Number of stocks in the group with closing price above their 50-day moving average,MATRIX,USA,TOP3000,1,0.9955,,,2026-07-16T15:20:39,possible_direction=unknown,50 above average closing day group indicators mdl10_1500_group_issues_above_50_day_avg model model10 moving number possible_direction price research stocks their unknown
model10,Research Indicators,Model,mdl10_1500_group_long_squeeze_potential,mdl10_1500_group_long_squeeze_potential,"Sum of percentages of stocks within the group classified as Type 2 and Type 4, indicating overall potential for ""long squeezes"" in the group",MATRIX,USA,TOP3000,1,0.9955,,,2026-07-16T15:20:39,possible_direction=unknown,as classified group indicating indicators long mdl10_1500_group_long_squeeze_potential model model10 overall percentages possible_direction potential research squeezes stocks sum type unknown within
model10,Research Indicators,Model,mdl10_1500_group_rank,mdl10_1500_group_rank,"The relative rank (1=highest, 139=lowest) of the industry group compared to all other groups by composite factors",MATRIX,USA,TOP3000,1,0.9955,,,2026-07-16T15:20:39,possible_direction=unknown,139 all by compared composite factors group groups highest indicators industry lowest mdl10_1500_group_rank model model10 other possible_direction rank relative research unknown
model10,Research Indicators,Model,mdl10_1500_group_short_squeeze_potential,mdl10_1500_group_short_squeeze_potential,"Sum of percentage of stocks in the group classified as Type 1 (Short Squeeze) and Type 3 (Shorts Are Right), indicating group-level potential for a short squeeze",MATRIX,USA,TOP3000,1,0.9955,,,2026-07-16T15:20:39,possible_direction=unknown,are as classified group indicating indicators level mdl10_1500_group_short_squeeze_potential model model10 percentage possible_direction potential research right short shorts squeeze stocks sum type unknown
model10,Research Indicators,Model,mdl10_1500_group_type_1,mdl10_1500_group_type_1,"Percentage of stocks within the industry group currently classified as ""Type 1"" (Short Squeeze setup)",MATRIX,USA,TOP3000,1,0.9955,,,2026-07-16T15:20:39,possible_direction=unknown,as classified currently group indicators industry mdl10_1500_group_type_1 model model10 percentage possible_direction research setup short squeeze stocks type unknown within
model10,Research Indicators,Model,mdl10_1500_group_type_2,mdl10_1500_group_type_2,Percentage of stocks in the group classified as Type 2 (Recognized Strength),MATRIX,USA,TOP3000,1,0.9955,,,2026-07-16T15:20:39,possible_direction=unknown,as classified group indicators mdl10_1500_group_type_2 model model10 percentage possible_direction recognized research stocks strength type unknown
model10,Research Indicators,Model,mdl10_1500_group_type_3,mdl10_1500_group_type_3,Percentage of stocks in the Erlanger Group currently classified as Type 3 (“Shorts Are Right”),MATRIX,USA,TOP3000,1,0.9955,,,2026-07-16T15:20:39,possible_direction=unknown,are as classified currently erlanger group indicators mdl10_1500_group_type_3 model model10 percentage possible_direction research right shorts stocks type unknown
model10,Research Indicators,Model,mdl10_1500_group_type_4,mdl10_1500_group_type_4,Percentage of stocks in the group currently classified as Type 4 (Long Squeeze),MATRIX,USA,TOP3000,1,0.9955,,,2026-07-16T15:20:39,possible_direction=unknown,as classified currently group indicators long mdl10_1500_group_type_4 model model10 percentage possible_direction research squeeze stocks type unknown
model10,Research Indicators,Model,mdl10_1500_high,mdl10_1500_high,Highest price reached by the stock during the trading day,MATRIX,USA,TOP3000,1,0.9977,,,2026-07-16T15:20:39,possible_direction=unknown,by day during highest indicators mdl10_1500_high model model10 possible_direction price reached research stock trading unknown
model10,Research Indicators,Model,mdl10_1500_inst_ownership,mdl10_1500_inst_ownership,Percentage of shares held by institutional investors,MATRIX,USA,TOP3000,1,0.9529,,,2026-07-16T15:20:39,possible_direction=unknown,by held indicators institutional investors mdl10_1500_inst_ownership model model10 percentage possible_direction research shares unknown
model10,Research Indicators,Model,mdl10_1500_long_heat,mdl10_1500_long_heat,"Percentage of time prior years’ seasonal strong zones overlapped with the current date, indicating historical seasonal strength",MATRIX,USA,TOP3000,1,0.9243,,,2026-07-16T15:20:39,possible_direction=unknown,current date historical indicating indicators mdl10_1500_long_heat model model10 overlapped percentage possible_direction prior research seasonal strength strong time unknown years zones
model10,Research Indicators,Model,mdl10_1500_long_zone_days,mdl10_1500_long_zone_days,"Number of days remaining in the current seasonal long zone, if present",MATRIX,USA,TOP3000,1,0.9243,,,2026-07-16T15:20:39,possible_direction=unknown,current days if indicators long mdl10_1500_long_zone_days model model10 number possible_direction present remaining research seasonal unknown zone
model10,Research Indicators,Model,mdl10_1500_long_zone_juice,mdl10_1500_long_zone_juice,"Value showing how much the seasonal cycle has moved for the stock, comparing the end of the current long zone to a relevant earlier date, highlighting seasonal strength",MATRIX,USA,TOP3000,1,0.9243,,,2026-07-16T15:20:39,possible_direction=unknown,comparing current cycle date earlier end has highlighting how indicators long mdl10_1500_long_zone_juice model model10 moved much possible_direction relevant research seasonal showing stock strength unknown value zone
model10,Research Indicators,Model,mdl10_1500_long_zone_rank,mdl10_1500_long_zone_rank,Ratio of Seasonal Long Zone Juice to Long Zone Days Remaining for the stock,MATRIX,USA,TOP3000,1,0.9243,,,2026-07-16T15:20:39,possible_direction=unknown,days indicators juice long mdl10_1500_long_zone_rank model model10 possible_direction ratio remaining research seasonal stock unknown zone
model10,Research Indicators,Model,mdl10_1500_low,mdl10_1500_low,Lowest price reached by the stock during the trading day,MATRIX,USA,TOP3000,1,0.9977,,,2026-07-16T15:20:39,possible_direction=unknown,by day during indicators lowest mdl10_1500_low model model10 possible_direction price reached research stock trading unknown
model10,Research Indicators,Model,mdl10_1500_market_cap,mdl10_1500_market_cap,"Company’s market capitalization, calculated as market price times shares outstanding",MATRIX,USA,TOP3000,1,0.9958,,,2026-07-16T15:20:39,possible_direction=unknown,as calculated capitalization company indicators market mdl10_1500_market_cap model model10 outstanding possible_direction price research shares times unknown
model10,Research Indicators,Model,mdl10_1500_market_cap_l,mdl10_1500_market_cap_l,"Market capitalization of the stock, expressed on a logarithmic scale",MATRIX,USA,TOP3000,1,0.9958,,,2026-07-16T15:20:39,possible_direction=unknown,capitalization expressed indicators logarithmic market mdl10_1500_market_cap_l model model10 possible_direction research scale stock unknown
model10,Research Indicators,Model,mdl10_1500_open,mdl10_1500_open,Opening price of the stock on the trading day,MATRIX,USA,TOP3000,1,0.9977,,,2026-07-16T15:20:39,possible_direction=unknown,day indicators mdl10_1500_open model model10 opening possible_direction price research stock trading unknown
model10,Research Indicators,Model,mdl10_1500_power_rank,mdl10_1500_power_rank,"Composite ranking combining Technical Rank and Short Rank, weighted more towards Technical Rank; normalized 1 to 100",MATRIX,USA,TOP3000,1,0.9759,,,2026-07-16T15:20:39,possible_direction=unknown,100 combining composite indicators mdl10_1500_power_rank model model10 more normalized possible_direction rank ranking research short technical towards unknown weighted
model10,Research Indicators,Model,mdl10_1500_price_10_day_mva,mdl10_1500_price_10_day_mva,10-day simple moving average of closing price,MATRIX,USA,TOP3000,1,0.9971,,,2026-07-16T15:20:39,possible_direction=unknown,10 average closing day indicators mdl10_1500_price_10_day_mva model model10 moving possible_direction price research simple unknown
model10,Research Indicators,Model,mdl10_1500_price_15_day_mva,mdl10_1500_price_15_day_mva,15-day simple moving average of closing price,MATRIX,USA,TOP3000,1,0.9971,,,2026-07-16T15:20:39,possible_direction=unknown,15 average closing day indicators mdl10_1500_price_15_day_mva model model10 moving possible_direction price research simple unknown
model10,Research Indicators,Model,mdl10_1500_price_200_day_mva,mdl10_1500_price_200_day_mva,"200-day simple moving average of the closing price of the stock, a long-term trend indicator",MATRIX,USA,TOP3000,1,0.9971,,,2026-07-16T15:20:39,possible_direction=unknown,200 average closing day indicator indicators long mdl10_1500_price_200_day_mva model model10 moving possible_direction price research simple stock term trend unknown
model10,Research Indicators,Model,mdl10_1500_price_20_day_mva,mdl10_1500_price_20_day_mva,20-day simple moving average of closing price,MATRIX,USA,TOP3000,1,0.9971,,,2026-07-16T15:20:39,possible_direction=unknown,20 average closing day indicators mdl10_1500_price_20_day_mva model model10 moving possible_direction price research simple unknown
model10,Research Indicators,Model,mdl10_1500_price_25_day_mva,mdl10_1500_price_25_day_mva,25-day simple moving average of the closing price of the stock,MATRIX,USA,TOP3000,1,0.9971,,,2026-07-16T15:20:39,possible_direction=unknown,25 average closing day indicators mdl10_1500_price_25_day_mva model model10 moving possible_direction price research simple stock unknown
model10,Research Indicators,Model,mdl10_1500_price_30_day_mva,mdl10_1500_price_30_day_mva,30-day simple moving average of closing price,MATRIX,USA,TOP3000,1,0.9971,,,2026-07-16T15:20:39,possible_direction=unknown,30 average closing day indicators mdl10_1500_price_30_day_mva model model10 moving possible_direction price research simple unknown
model10,Research Indicators,Model,mdl10_1500_price_35_day_mva,mdl10_1500_price_35_day_mva,35-day simple moving average of closing price,MATRIX,USA,TOP3000,1,0.9971,,,2026-07-16T15:20:39,possible_direction=unknown,35 average closing day indicators mdl10_1500_price_35_day_mva model model10 moving possible_direction price research simple unknown
model10,Research Indicators,Model,mdl10_1500_price_40_day_mva,mdl10_1500_price_40_day_mva,40-day simple moving average of the closing price of the stock,MATRIX,USA,TOP3000,1,0.9971,,,2026-07-16T15:20:39,possible_direction=unknown,40 average closing day indicators mdl10_1500_price_40_day_mva model model10 moving possible_direction price research simple stock unknown
model10,Research Indicators,Model,mdl10_1500_price_45_day_mva,mdl10_1500_price_45_day_mva,45-day simple moving average of the stock’s closing price,MATRIX,USA,TOP3000,1,0.9971,,,2026-07-16T15:20:39,possible_direction=unknown,45 average closing day indicators mdl10_1500_price_45_day_mva model model10 moving possible_direction price research simple stock unknown
model10,Research Indicators,Model,mdl10_1500_price_50_day_mva,mdl10_1500_price_50_day_mva,"50-day simple moving average of closing prices, used to assess the trend or momentum of a stock",MATRIX,USA,TOP3000,1,0.9971,,,2026-07-16T15:20:39,possible_direction=unknown,50 assess average closing day indicators mdl10_1500_price_50_day_mva model model10 momentum moving possible_direction prices research simple stock trend unknown used
model10,Research Indicators,Model,mdl10_1500_price_5_day_mva,mdl10_1500_price_5_day_mva,5-day simple moving average of the closing price of the stock,MATRIX,USA,TOP3000,1,0.9971,,,2026-07-16T15:20:39,possible_direction=unknown,average closing day indicators mdl10_1500_price_5_day_mva model model10 moving possible_direction price research simple stock unknown
model10,Research Indicators,Model,mdl10_1500_price_65_day_mva,mdl10_1500_price_65_day_mva,"65-day simple moving average of closing prices, a longer-term trend indicator",MATRIX,USA,TOP3000,1,0.9971,,,2026-07-16T15:20:39,possible_direction=unknown,65 average closing day indicator indicators longer mdl10_1500_price_65_day_mva model model10 moving possible_direction prices research simple term trend unknown
model10,Research Indicators,Model,mdl10_1500_prior_short_rank,mdl10_1500_prior_short_rank,Short interest rank from previous reporting period (released biweekly),MATRIX,USA,TOP3000,1,0.976,,,2026-07-16T15:20:39,possible_direction=unknown,biweekly from indicators interest mdl10_1500_prior_short_rank model model10 period possible_direction previous rank released reporting research short unknown
model10,Research Indicators,Model,mdl10_1500_prior_short_ratio,mdl10_1500_prior_short_ratio,Short interest ratio from the previous reporting period (about two weeks prior),MATRIX,USA,TOP3000,1,0.9951,,,2026-07-16T15:20:39,possible_direction=unknown,about from indicators interest mdl10_1500_prior_short_ratio model model10 period possible_direction previous prior ratio reporting research short two unknown weeks
model10,Research Indicators,Model,mdl10_1500_put_call_erlanger_ratio,mdl10_1500_put_call_erlanger_ratio,Volume weighted average price ratio of put options to call options for the stock,MATRIX,USA,TOP3000,1,0.9522,,,2026-07-16T15:20:39,possible_direction=volume,average call indicators mdl10_1500_put_call_erlanger_ratio model model10 options possible_direction price put ratio research stock volume weighted
model10,Research Indicators,Model,mdl10_1500_put_call_erlanger_ratio_10_day,mdl10_1500_put_call_erlanger_ratio_10_day,"10-day median of the puts to calls premium ratio, measuring the volume-weighted average price of a stock’s options, indicative of sentiment/trading activity",MATRIX,USA,TOP3000,1,0.9507,,,2026-07-16T15:20:39,possible_direction=volume,10 activity average calls day indicative indicators mdl10_1500_put_call_erlanger_ratio_10_day measuring median model model10 options possible_direction premium price puts ratio research sentiment stock trading volume weighted
model10,Research Indicators,Model,mdl10_1500_put_call_ratio,mdl10_1500_put_call_ratio,"Ratio of put options volume to call options volume for the current day, indicating market sentiment",MATRIX,USA,TOP3000,1,0.9522,,,2026-07-16T15:20:39,possible_direction=volume,call current day indicating indicators market mdl10_1500_put_call_ratio model model10 options possible_direction put ratio research sentiment volume
model10,Research Indicators,Model,mdl10_1500_put_call_ratio_10_day,mdl10_1500_put_call_ratio_10_day,"10-day median of the put to call volume ratio, smoothing out daily fluctuations to show a trend in options trading sentiment",MATRIX,USA,TOP3000,1,0.9507,,,2026-07-16T15:20:39,possible_direction=volume,10 call daily day fluctuations indicators mdl10_1500_put_call_ratio_10_day median model model10 options out possible_direction put ratio research sentiment show smoothing trading trend volume
model10,Research Indicators,Model,mdl10_1500_put_volume,mdl10_1500_put_volume,Daily volume of put option contracts traded for the stock,MATRIX,USA,TOP3000,1,0.9522,,,2026-07-16T15:20:39,possible_direction=volume,contracts daily indicators mdl10_1500_put_volume model model10 option possible_direction put research stock traded volume
